_url,name,company_size,industry,about_us,website,founded,company_type,specialties,headquarters_city,headquarters_province,headquarters
https://www.linkedin.com/company/dekatel-telecom-bv/,Dekatel Telecom BV,11-50 employees,Telecommunications,"Dekatel: verbindt ondernemers

Uw bedrijf gezond houden. Uw marktpositie verstevigen. De nieuwste ontwikkelingen volgen en waar mogelijk voor zijn. Ondernemen is een hele onderneming. Om zeker te weten dat u altijd bereikbaar bent, neemt Dekatel u de telecommunicatiediensten uit handen. Of het nu gaat om mobiele telefonie, mobiel internet, vaste telefonie of vast internet.

Duidelijkheid, dat is waar Dekatel voor staat. Inzicht en zekerheid zijn voor ons vanzelfsprekend. 

Daarnaast vinden wij het belangrijk om uw organisatie goed te kennen. Wij leggen u mogelijkheden voor die aansluiten bij uw wensen en maken samen met u de juiste keuzes. Zo heeft u de zekerheid van een voordelige, kwalitatief hoogwaardige oplossing. En kunt u zorgeloos ondernemen.",http://www.dekatel.nl,1989.0,Privately Held,"mobiel bellen, mobiel internet, vaste telefonie, VoIP, zakelijke markt, vast internet, straalverbinding, aantrekkelijke Europese tarieven, scheepvaart, transport, zorg",IJsselmuiden,Overijssel,"IJsselmuiden, Overijssel"
https://www.linkedin.com/company/den-dulk-advies/,den Dulk Advies,0-1 employees,Information Services,Ruimte voor meerdere perspectieven met focus op de bedoeling,http://www.dendulkadvies.nl,2019.0,Self-Employed,,Diepenveen,Nederland,"Diepenveen, Nederland"
https://www.linkedin.com/company/denoudeninformatiebeveiliging/,Den Ouden Informatiebeveiliging,2-10 employees,Information Technology & Services,Beschermt uw informatie.,https://www.denoudeninformatiebeveiliging.nl,2015.0,Self-Employed,"Ethical Hacking, IT Security, AVG, GDPR, Pentest, Security Test, Social Engineering, Trainings, Talks, Presentations, Keynote speaker, ISO:27001, Informatiebeveiliging, Advies, Consultancy, Hacker:404, Hacker, Privacy",Hardenberg,Overijssel,"Hardenberg, Overijssel"
https://www.linkedin.com/company/denko-domotica/,Denko Domotica,2-10 employees,Information Technology & Services,Denko creëert functionele oplossingen voor IoT.,https://denko.nl/domotica/,2001.0,Privately Held,"Domotica, KNX, Automatisering",Oldenzaal,Overijssel,"Oldenzaal, Overijssel"
https://www.linkedin.com/company/deploybox-internet-services/,Deploybox Internet Services,2-10 employees,Information Services,"This listing was automatically created by LinkedIn. This listing is not currently maintained by, endorsed by or affiliated with Deploybox Internet Services. Learn more",http://deploybox.io,2011.0,,,Olst,Overijssel,"Olst, Overijssel"
https://www.linkedin.com/company/designapp/,Designapp,2-10 employees,Computer Software,DesignApp is een app ontwikkelingsbureau dat gevestigd is in Deventer. DesignApp heeft meer dan 5 jaar ervaring met het ontwikkelen van mobiele applicaties. Wij maken gebruik van de modernste technieken en spelen in op de nieuwste trends. Met passie ontwikkelen wij de prachtigste apps die voldoen aan al uw wensen en verwachtingen.,http://www.designapp.nl/,2015.0,Self-Employed,"Apps, IOS apps, Android apps, Swift",Deventer,Overijssel,"Deventer, Overijssel"
https://www.linkedin.com/company/deskie/,Deskie,2-10 employees,Information Technology & Services,Reserveer makkelijk en snel je werkplek met Deskie.,http://www.deskie.nl,2020.0,Partnership,,Zwolle,Overijssel,"Zwolle, Overijssel"
https://www.linkedin.com/company/devcake/,DEVcake,2-10 employees,Computer Software,Maakt ontwikkelen leuk,https://devcake.nl,2016.0,Partnership,"Mobile development, Serious gaming, gamification, augmented reality, virtual reality, web development",Deventer,Overijssel,"Deventer, Overijssel"
https://www.linkedin.com/company/dewebsitebouwer-nl/,deWebsitebouwer.nl,0-1 employees,Information Technology & Services,"deWebsitebouwer.nl biedt naast een mooie website ook een breed scala aan diensten. Wij richten ons op starters, zzp-ers en het MKB. Wij bouwen aan een persoonlijke relatie, dat vinden wij belangrijk om zo de optimale ICT voorziening 

De Cloud is geen hype meer maar biedt serieuze diensten. Met name voor starters, zzp-ers en MKB bedrijven kunt u tegen zeer betaalbare prijzen geavanceerde software gebruiken die normaal voor grote bedrijven zijn weggelegd. Met SaaS (Software as a Service) kunt u als starter een vliegende start maken. Wij helpen u daar graag bij zodat u zich kunt richten op uw business.

Naast het verzorgen van een mooie website voor u of uw bedrijf kunnen wij u ook een breed scala aan software leveren dat u kunt gebruiken via Internet. Wij selecteren de best passende software voor u en richten deze in en ondersteunen u in het gebruik daarbij.
Wij hebben ervaring met:
- Google Apps
- Contact Relation Management Software
- Factureringsystemen
- Online betalingen (Ideal en PayPal)
- Boekhoudpakketten
- en nog veel meer.

Zoekt u een specifieke oplossing, neem vrijblijvend contact met ons op.

Tevens kunnen wij u helpen met marketing campagnes op Internet. Wij kunnen voor u adverteren op diverse platformen zoals Google, Bing, Marktplaats en diverse banner netwerken.",http://www.dewebsitebouwer.nl,2013.0,Sole Proprietorship,"Webhosting, Design websites maken, SaaS (Software As A Service)",Losser,Overijssel,"Losser, Overijssel"
https://www.linkedin.com/company/dezta-b.v./,Dezta B.V.,11-50 employees,Publishing,"Dezta B.V. is a publishing company based out of Hanzelaan 272, ZWOLLE, Netherlands.",http://www.roxit.nl,,,,,,
https://www.linkedin.com/company/dictu/,DICTU,"1,001-5,000 employees",Information Technology & Services,"DICTU, onderdeel van het Ministerie van Economische Zaken, is specialist in het ontwikkelen- en beheren van systemen en applicaties, die essentieel zijn in strategisch werk bij de overheid en het bedrijfsleven. Ook speelt DICTU een rol bij de vorming van een rijksbreed cluster van ICT voorzieningen. 

DICTU monitort 24 uur per dag 365 dagen per jaar de systemen die voor de klant kritisch zijn. Alle processen, systemen en applicaties voldoen aan de strenge eisen van de internationale informatiebeveiligingsnorm ISO 27001. DICTU bezit dan ook het ISO 27001 certificaat.

Kengetallen 

DICTU beheert: 
- 13.000 werkplekken 
- 1000 speciale bedrijfsapplicaties 
- Dataverbindingen circa 210 locaties 
- Omzet in 2015 circa 240 mln


Hoofdkantoor:
Bezuidenhoutseweg 73
Postbus 20401
2500 EK Den Haag

Volg ons ook op Twitter: @DICTUnieuws",http://www.dictu.nl,2005.0,Government Agency,ICT,,,
https://www.linkedin.com/company/diezit-marketing-&-communicatie/,diezit.,11-50 employees,Marketing & Advertising,"Marketing, communicatie en branding. Met resultaat. Wij zetten uw bedrijf/merk in de markt. Door uw verhaal op zo’n manier te vertellen dat niemand er meer omheen kan.

Meedenken over de strategie. U bestoken met wilde ideeën. Mooie middelen maken. De ene keer verzorgen we het complete traject (A tot Z), de andere keer een onderdeel. Daar werken we met dezelfde passie aan. Omdat we weten dat uw visitekaartje ook ons visitekaartje is.

We hebben een mix van praters, denkers en doeners in huis. Van Wilde Wauw!ters tot Willie Wortels en Stille Willies. Stuk voor stuk zijn ze steengoed in wat zij doen. Verschillende kwaliteiten, één doel: zorgen dat u uw doel bereikt.",http://www.diezit.nl,2010.0,Privately Held,,Deventer,Overijssel,"Deventer, Overijssel"
https://www.linkedin.com/company/differit-b.v./,DifferIT B.V.,11-50 employees,Information Technology & Services,DIFFERIT | Officieel AFAS software partner,http://www.differit.nl,2013.0,Privately Held,"AFAS Software, projectmanagement, business consultancy, applicatiebeheer, zakelijke dienstverlening, culturele sector, implementatie, optimalisatie",Hengelo,Overijssel,"Hengelo, Overijssel"
https://www.linkedin.com/company/digital-chef/,Digital Chef,11-50 employees,Computer Software,3D Food & Packaging Design for Digital Education - Digital Marketing - Development,http://www.digitalchef.eu,2019.0,Privately Held,"3D, 3D Food, CGI, CGF, Packshots, E-commerce, Foodindustry, Digital, Innovation , Computer Generated Food, 3D Advertising",Enschede,Overijssel,"Enschede, Overijssel"
https://www.linkedin.com/company/digital-growth-netherlands/,Digital Growth,2-10 employees,Information Technology & Services,"Digitaal Bureau, en uw digitale hersenhelft

De juiste keuzes leiden tot een digitaal succes, ze maken het verschil tussen het wel en niet realiseren van je doelstellingen!  Tussen geld verdienen, en veel geld verliezen. Stress, of geen stress. Maar wat is de juiste beslissing?

Met de huidige digitale mogelijkheden, complexiteit en innovatie heeft u bijna een extra hersenhelft nodig. Als ondernemer is het erg lastig om het allemaal bij te houden, helemaal als u ook nog eens de ontwikkeling, inzet en optimalisatie moet implementeren.

Wij zijn de derde hersenhelft van uw organisatie die jullie helpt om de juiste beslissingen te maken voor uw doelstellingen. Digital Growth help u met het verbinden van verschillende digitale werelden voor optimaal resultaat.

Benieuwd wat wij voor uw onderneming kunnen betekenen? Klik dan op de knop hieronder, en we plannen een vrijblijvende afspraak in.

Roy Nijland
Roy@digital-growth.nl
+31 06 44 18 66 90",http://digital-growth.nl,2017.0,Self-Employed,"Web Development, SEO, Adwords, Conversion Optimization, Lead Generation, PPC, Wordpress, PHP, Laravel, Drupal",Zwolle,Overijssel,"Zwolle, Overijssel"
https://www.linkedin.com/company/digital-sourcing-b-v/,Digital Sourcing B.V.,0-1 employees,Information Technology & Services,We ensure that the use of digital technology and its suppliers contributes as much as possible to business objectives.,http://www.digitalsourcing.nl,2019.0,Privately Held,"Digital sourcing , IT procurement , IT sourcing, contract management , vendor management , sourcing strategy , digital sourcing strategy , IT inkoop",,,
https://www.linkedin.com/company/digitalewerkplaatstwente/,Digitale Werkplaats Twente,2-10 employees,Information Technology & Services,De Digitale Werkplaats Twente helpt ondernemers met ICT en Digitale Marketing vraagstukken op weg.,https://www.digitalewerkplaatstwente.nl,,Nonprofit,,,,
https://www.linkedin.com/company/digiunit/,DigiUnit,0-1 employees,Computer Software,,https://www.digiunit.nl,,Privately Held,,Hengelo,Overijssel,"Hengelo, Overijssel"
https://www.linkedin.com/company/digiworks_3/,DigiWorks,2-10 employees,Information Technology & Services,"DigiWorks is een veelzijdige IT-dienstverlener die gekenmerkt wordt door kennis en kwaliteit van haar IT oplossingen. Uitgangspunt hierbij is altijd de visie en de wens van de klant.

Samen met klanten werken we aan het verbeteren van hun operationele efficiency, het optimaliseren van de kwaliteit van hun services.",http://www.digiworks.nl,2005.0,Public Company,dienstverlening,,,
https://www.linkedin.com/company/direct-repairs-bv/,Direct Repairs BV,11-50 employees,Telecommunications,"Wat wij doen als bedrijf:"" Direct Repairs B.V.""

Het repareren van smartphones, tablets, iMacs en Macbooksen troubleshooting hardware en software matig voor particulieren. 

Herstellen voor verzekeringen.

Reparaties op frequente basis voor zakelijke relaties.

Tevens leveren wij onderdelen en accessoires.


Dochterbedrijf van DirectPC, www.directpc.nl",,2015.0,Partnership,"Apple, Samsung, HTC, LG, Nokia, Fujitsu",Zwolle,Overijssel,"Zwolle, Overijssel"
https://www.linkedin.com/company/diritsoftware/,DirIT Software,2-10 employees,Information Technology & Services,"Maatwerk software, CRM, ERP, websites voor elk bedrijf.",http://www.dirit.nl,2018.0,Sole Proprietorship,"Software, CRM, ERP, Bedrijfssoftware, Maatwerk Software, ICT, IT, Advies, Software op maat, Web applicaties, Mobiele applicaties, Apps",Wierden,Overijssel,"Wierden, Overijssel"
https://www.linkedin.com/company/dirttrack/,Dirttrack B.V.,0-1 employees,Information Technology & Services,Just different in the field of IT business. Development of DT.erp a cloud software solution for small business.,http://www.dirttrack.nl,2011.0,Public Company,"Consulting services, Business consultancy, SAP ByDesign, Data migration, Interfacing development, opencart, shopware, MariaDB, SQL",IJhorst,Overijssel,"IJhorst, Overijssel"
https://www.linkedin.com/company/disc-developments/,Disc,2-10 employees,Information Technology & Services,Automatisering & software voor de industrie,https://disc.dev,1996.0,Public Company,,Zwolle,Overijssel,"Zwolle, Overijssel"
https://www.linkedin.com/company/dispaper/,Dispaper,2-10 employees,Information Technology & Services,Smart Paper Solutions,https://dispaper.nl/,2019.0,Privately Held,"Smart Paper, E-Paper, Room Booking, Internet of Things, Displays",,,
https://www.linkedin.com/company/docassist-b.v./,DocAssist B.V.,2-10 employees,Information Technology & Services,DocAssist provides Cloud  Solutions and Services for intelligent process automation with a key focus on purchase to pay and document management.,http://www.docassist.nl,2016.0,Partnership,Document Management and Invoices Processing,Enschede,Overijssel,"Enschede, Overijssel"
https://www.linkedin.com/company/docbird/,Docbird,2-10 employees,Computer Software,"Nieuwe stijl contractbeheer, documentbeheer en digitaal ondertekenen",https://docbird.nl,,Privately Held,"Contractbeheer, Documentbeheer, Digitaal ondertekenen",Enschede,Overijssel,"Enschede, Overijssel"
https://www.linkedin.com/company/docdynamic-b-v-/,Docdynamic B.V.,11-50 employees,Computer Software,Sinds 2004 helpen wij organisaties hun slagvaardigheid te verbeteren door de kwaliteit en toegankelijkheid te verhogen.,http://www.docdynamic.nl,2004.0,Public Company,"DMS digitale dossiers, digitale archivering & workflows, Enterprise Content Management (ECM), DMS voor advocaten en notarissen",Enschede,Overijssel,"Enschede, Overijssel"
https://www.linkedin.com/company/docksters/,"Docksters, IoT Cloud Monitoring",11-50 employees,Computer Software,"Docksters is an Dutch IoT cloud platform that specializes in data management, analytics, monitoring and visualization.",https://docksters.io,2018.0,Public Company,"IoT software, IoT platform, IoT monitoring, Smart sensoring, Internet of Things, IoT, Slimme sensoren, Visualisatie",Zwolle,Overijssel,"Zwolle, Overijssel"
https://www.linkedin.com/company/docrunner/,DocRunner - For modern outputmangement,,Computer Software,"DocRunner is developed for organizations that have to process tremendous and intricate documents such as manuals, propositions, (insurance) policies, or extensive reports. Organizations who want to increase efficiency and where mistakes can be devastating. Not only because mistakes can damage the company image, also because it takes time to fix mistakes. Time which could be spend on more productive activities. Traditional methods of document processing can take several hours or even weeks. With DocRunner these processes are reduced to several seconds, without the risk of mistakes.",https://www.userv.nl/nl/oplossingen/docrunner/,,,,,,
https://www.linkedin.com/company/docucontrol-bv/,DocuControl BV,2-10 employees,Information Technology & Services,"DocuControl is a project consultancy agency for Document Management en Document Control.
DocuControl works within the following fields: 
Consultancy
Process Management
Document Control Outsourcing",,,Privately Held,,,,
https://www.linkedin.com/company/docu-scan/,DocuScan,2-10 employees,Information Technology & Services,"Uw papieren informatie direct digitaal toegankelijk? Docuscan digitaliseert, van statisch papier naar bruikbare data.",https://docuscan.nl,,Partnership,,Enschede,Overijssel,"Enschede, Overijssel"
https://www.linkedin.com/company/dollen-consultancy/,Dollen Consultancy,0-1 employees,Information Technology & Services,"Dollen Consultancy ondersteunt organisaties uit verschillende branches bij het toepassen van SAS oplossingen door middel van deskundige advisering over en het realiseren van ontwikkel-, implementatie- en beheertrajecten. Klanttevredenheid is daarbij het uitgangspunt. Dollen Consultancy richt zich voornamelijk op de regio Noord-Oost en Midden Nederland.",http://www.dollenconsultancy.nl,2014.0,Public Company,,,,
https://www.linkedin.com/company/domani-business-solutions-b-v-/,Domani Business Solutions,11-50 employees,Information Technology & Services,SAP Business One + Partner add-ons + Innovatieve Cloud toepassingen = Branche specifieke ERP in MKB.,http://www.domani-bs.com,2003.0,Privately Held,"SAP Business One, SAP Cloud, Voorraadbeheer, Service & onderhoud, Financieel beheer, CRM, Verkoop & inkoop, Produmex, SAP Analytics Cloud, Groothandel, MKB, Productie, Field Services, Boyum, CoreSuite, Internationale SAP Business One implementaties, SAP HANA, ERP Sof",Venlo,Limburg,"Venlo, Limburg"
https://www.linkedin.com/company/domoticagigant/,domoticaGIGANT,2-10 employees,Information Technology & Services,"We make your life safer, easier and more fun!",https://www.domoticagigant.nl,2014.0,Public Company,"Domotica, Gatgets, Z-Wave Alliance, Slim wonen, energie, beveiliging, smart homes, smart buildings, bouw, makelaardij, installatiewerk, installateur, FIBARO Home Intelligence, Z-Wave, ICT, smart homes, smart home, slim wonen, slimme woning, slim leven, IoT",Enter,Overijssel,"Enter, Overijssel"
https://www.linkedin.com/company/donate-with-trust/,Donate With Trust,2-10 employees,Information Technology & Services,We zijn een technologie bedrijf met de visie om donaties transparant te maken.,,2019.0,Sole Proprietorship,,,,
https://www.linkedin.com/company/doolhof-advies/,Doolhof Advies,0-1 employees,Information Technology & Services,Het adviseren in en verbeteren van (digitale) bedrijfsprocessen,http://www.doolhof-advies.nl,,Sole Proprietorship,,,,
https://www.linkedin.com/company/doopcompany/,Doop,11-50 employees,Marketing & Advertising,"We are Doop,
Doop does wonders for your business. Using a smart mix of technology and creativity, we redefine it. We’ll give it a permanent spot in your customer’s hearts and minds. But whatever we come up with, we make sure it works. We let creativity, technology and data work for you on every medium and every platform. Doop is for companies that are relevant and want to stay relevant for a long time.",https://wearedoop.com,2020.0,Privately Held,"strategy, creativity, design, technology, services, intelligence",Enschede,Overijssel,"Enschede, Overijssel"
https://www.linkedin.com/company/doornautomatisering/,Doorn Automatisering,2-10 employees,Information Technology & Services,Doorn Automatisering biedt ICT-oplossingen en deskundig advies voor het midden- en kleinbedrijf.,https://www.doornautomatisering.com,2012.0,Partnership,,IJsselmuiden,Overijssel,"IJsselmuiden, Overijssel"
https://www.linkedin.com/company/doornenbal-telecom-b.v./,Doornenbal Telecom & ICT,2-10 employees,Information Technology & Services,Vanzelfsprekend !,https://www.doornenbaltelecom.nl,,Public Company,"IT, ICT, Audio, Video, Observatie, VoIP",Nijverdal,Overijssel,"Nijverdal, Overijssel"
https://www.linkedin.com/company/douma-business-solutions/,Douma Business Solutions,0-1 employees,Information Technology & Services,"Passie voor stromende projecten ...

BETROUWBAAR en ALLROUND
douma business solutions is al 25 jaar een betrouwbare allround partner die ruime ervaring en kennis heeft in het leiden van veranderingsprocessen binnen organisaties, welke ICT gerelateerd zijn.

OPLOSSINGEN voor de BUSINESS
Centraal staat de strategie van de onderneming en het daaruit voortvloeiende beleid voor de business. De business omvat de klanten, gebruikersorganisatie en beheerorganisatie. De gebruikersorganisatie vult in hoe zij, binnen de kaders van het strategie beleid van de organisatie, haar tactische en operationele werkzaamheden wil uitvoeren gericht op haar klanten. De gerelateerde ICT beheerorganisatie en projecten faciliteren de gebruikersorganisatie.",,2006.0,Privately Held,,,,
https://www.linkedin.com/company/downnotifier/,DownNotifier.com,11-50 employees,Computer Networking,"DownNotifier sends a free alert when your website is down.

With up to 20 seconds monitoring DownNotifier.com is the best tool to be on top of the availability of your websites.

Just try and see what it does :)",https://www.downnotifier.com,2013.0,Privately Held,"Website monitoring, Monitoring, High availability, www.",Zwolle,Overijssel,"Zwolle, Overijssel"
https://www.linkedin.com/company/17918934/,drabblez,0-1 employees,Individual & Family Services,"Onze missie is heel kort & krachtig:

Kinderen te laten genieten van de natuur!

Dat klinkt simpel, en dat is het ook, maar het vraagt voorbereiding!

Onze kinderen zijn de volwassenen van de toekomst en zij gaan prioriteiten stellen, keuzes maken, technieken ontwikkelen, consumeren en.... leven. Als het kan zo duurzaam mogelijk, zodat ook hun kinderen genieten van frisse lucht, schoon water en gezond eten.",http://buitenspelennatuurlijk.org,2015.0,Self-Employed,,Deventer,Overijssel,"Deventer, Overijssel"
https://www.linkedin.com/company/ductusbv/,Ductus b.v.,2-10 employees,Information Technology & Services,"gespecialiseerd in data architectuur, business architectuur, proces modellering, projectmanagement, agile voortbrenging, microsoft .net en sql development",http://www.ductus.nl,2017.0,Partnership,"Microsoft, .Net, SQL, Angular, enterprise architectuur, agile projectmanagement, disruptieve veranderingen, kwadrantenmodel, data ontvangst en data verwerking",Enschede,Overijssel,"Enschede, Overijssel"
https://www.linkedin.com/company/duidluck/,duidluck,2-10 employees,Information Technology & Services,"Welkom bij Duidluck!
Audiovisueel Presenteren

Duidluck is een landelijk opererende organisatie op het gebied van audiovisueel presenteren. Duidluck steekt de handen écht uit de mouwen van idee tot advies, van schets tot realisatie. Een audiovisuele ruimte geoptimaliseerd voor uw wensen en behoeften.

Vanuit onze jarenlange ervaring en kennis biedt Duidluck audiovisuele oplossingen voor het bedrijfsleven, de onderwijs sector en overheidsinstellingen. Zowel voor profit als non profit organisaties biedt Duidluck maat oplossingen, u krijgt “value for money”.

Neem de proef op de som en daag ons uit!

Contact
T +31 (0)38 - 425 40 30
M +31 (0)6 - 22 86 11 47

E info@duidluck.nl
I www.duidluck.nl",http://www.duidluck.nl,2010.0,Public Company,"Digibord | Touchscreen | Beamer | Projectiescherm | i3TOUCH | Hippo, Onderhoud | Service | After Sales, AV inrichtingen | B to B | Onderwijs | Vergaderruimtes | Boardrooms | Klaslokalen | Congrescentra | Kantines, Analyse | Advies | Inkoop | AV inri",Zwolle,Overijssel,"Zwolle, Overijssel"
https://www.linkedin.com/company/dutch-cloud/,Dutch Cloud,11-50 employees,Information Technology & Services,Cloud-diensten voor de MKB+ markt en Nederlandse softwarehuizen,http://www.dutchcloud.com,2009.0,Privately Held,"Cloud Computing, Infrastructure as a Service, Cloud by Design, Transparency, Compliance Management, Control, Managed Services",Amsterdam,North Holland,"Amsterdam, North Holland"
https://www.linkedin.com/company/dutch-devices/,Dutch Devices,2-10 employees,Information Technology & Services,De wereld om ons heen efficiënter maken. Dat is wat wij doen. Met innovatieve technologieën als NB-IoT.,https://dutchdevices.nl,,Self-Employed,,Hasselt,Overijssel,"Hasselt, Overijssel"
https://www.linkedin.com/company/dutch-it-works-bv/,Dutch IT Works BV,0-1 employees,Information Technology & Services,Salesforce & .Net custom software solutions,http://www.dutch-it-works.nl,2010.0,Sole Proprietorship,Software ontwikkeling,,,
https://www.linkedin.com/company/dutchvdi/,DutchVDI,2-10 employees,Information Technology & Services,"DutchVDI is een all inclusive ICT leverancier. Van het leveren van een PC of server, tot een vol geautomatiseerde datacenter of Desktop Online oplossing. Met onze partners en leveranciers zijn wij in staat om zowel kleine MKB omgevingen tot op grotere schaal (200 werkplekken) te ondersteunen. Voor een totaaloverzicht van onze producten kunt u terecht op onze website.",http://www.dutchvdi.nl,2010.0,Public Company,"Desktop Online, Systeembeheer, Backup Online, Webhosting",Steenwijk,Overijssel,"Steenwijk, Overijssel"
https://www.linkedin.com/company/2360625/,Dutchview IT,11-50 employees,Information Technology & Services,"We believe that when you work smart and efficiently together, the overall job satisfaction will increase and better results will be achieved. As Dutchview Information Technology we develop innovative software that helps you to do so, by making work processes easier, smarter and more enjoyable. 

With our knowledge of IT, organizations and the construction industry we have developed two successful products so far: Ed Controls and FlexWhere. 

Dutchview has offices in the Netherlands (Deventer), United Kingdom (London), Germany (Steinfurt) and India (Bangalore).",https://www.dutchview.com,2011.0,Privately Held,"Communicatieverbetering door gebruik van slimme software, Ed Controls, FlexWhere",,,
https://www.linkedin.com/company/dutchview-it/,Dutchview IT,11-50 employees,Information Technology & Services,We make it easy for you!,https://www.dutchview.com,2011.0,Privately Held,"Communicatieverbetering door gebruik van slimme software, Ed Controls, FlexWhere",,,
