_url,name,company_size,industry,about_us,website,founded,company_type,specialties,headquarters_city,headquarters_province,headquarters
https://www.linkedin.com/company/neerlandsvlak/,.NLVK,11-50 employees,Marketing & Advertising,"Creatief bureau voor mensen en merken. 
Altijd oorspronkelijk, vanuit een nieuw vlak. 
We gaan altijd voor inhoud en waarde. Luisteren naar onze opdrachtgevers, maar verrassen je graag met een eigen signatuur. 
Kritisch en nuchter werken we aan oplossingen die substantiëel wat voor jou of voor je doelgroep verandert en betekent. Meer waarde.",http://www.nlvk.nl,2007.0,Partnership,"Grafisch ontwerp, huisstijl, marketing, periodieken, magazines, strategie, communicatie, organisatieverandering, online marketing , creatie, art direction, design, creatieve strategie, verandermanagement, branding, full service bureau, sparring partner, merknaamontwi",,,
https://www.linkedin.com/company/1-&-al-reclame-b.v./,1 & al reclame B.V.,11-50 employees,Marketing & Advertising,"1 & al reclame B.V. is a marketing and advertising company based out of Zompstraat 31, RAALTE, Netherlands.",http://www.1enalreclame.nl,,,,,,
https://www.linkedin.com/company/123telcom-b.v./,123Telcom B.V.,11-50 employees,Telecommunications,"123Telcom B.V. is a telecommunications company based out of Capitool 10, ENSCHEDE, Netherlands.",http://www.123telcom.nl,,,,,,
https://www.linkedin.com/company/1incloud/,1InCloud B.V.,2-10 employees,Information Technology & Services,"Uw IT in de cloud?

Met 1InCloud kiest u voor hoge beschikbaarheid, flexibiliteit en een zorgeloze IT, en kiest uw tegelijkertijd ook voor duurzaamheid en lagere kosten.

1inCloud beschikt over een duurzaam Cloud- en Big Data platform in een eigen duurzaam datacenter van waaruit klanten en partners Cloud-, Big Data & Analytics- en Contentdiensten op klimaat neutrale wijze kunnen afnemen.

 Niet alleen wordt daarmee bijgedragen aan de ambities en doelstellingen die organisaties steeds vaker stellen aan duurzaam- en maatschappelijk verantwoord ondernemen, maar het brengt tegelijkertijd ook nog eens een enorm kostenvoordeel met zich mee en besparen klanten daarmee minimaal 25% op de kosten door significante energiebesparingen.

www.1inCloud.com",http://www.1inCloud.com,2015.0,Privately Held,"Cloud-, Big Data & Analytics en Content Cloud diensten, Bijdrage aan MVO ambities van klanten, Diensten aangeboden vanuit een eigen, klimaatneutraal datacenter, Door energievoordeel significant lagere kosten",,,
https://www.linkedin.com/company/1transvir/,1TransVir B.V.,2-10 employees,Information Technology & Services,"1TransVir  Duurzaam, zorgeloos en voordelig.

Uw IT in de cloud? Het ‘cloudsourcen’ van uw IT is een verstandige keuze, immers werken in de cloud, betekent werken zonder zorgen. 

En kiest u voor 1TransVir? Dan kiest u niet alleen voor een datacenter en datacenter diensten die hoge beschikbaarheid, flexibiliteit en een zorgeloze IT kan bieden, maar kiest u tegelijkertijd ook voor duurzaamheid en lagere kosten.

Niet alleen wordt daarmee bijgedragen aan de ambities en doelstellingen die organisaties steeds vaker stellen aan duurzaam en maatschappelijk verantwoord ondernemen, maar het brengt tegelijkertijd ook nog eens een enorm kostenvoordeel met zich mee.

 1TransVir is als klimaatneutraal datacenter gekwalificeerd als uw partner om Cloud- , Big Data & Analytics en Content Cloud diensten te verzorgen. 

Het fundament van onze dienstverlening is ons eigen datacenter in Deventer. Door gebruik te maken van een uniek en energiezuinig koelsysteem, opwek van eigen stroom en gebruikmakend van windenergie is 1TransVir in staat tot 60% energie te besparen en CO2 uitstoot tot een minimum te beperken.

1TransVir biedt klanten de volgende voordelen:
 
• Minimaal 25% goedkoper dan andere aanbieders
• Duurzaam en klimaatneutraal
• Ondersteunt uw MVO doelstellingen
• Hoge beschikbaarheid, eenvoudige migratie
• Geen investeringen in hard- en software
• Betaal voor gebruik principe.

Vanuit ons datacenter bieden we datacenter oplossingen en managed services. Ook voor Cloud, Big Data & Analytics en Content Cloud diensten alsmede technisch applicatiebeheer kunt u bij ons terecht. 

www.1TransVir.com",http://www.1TransVir.com,2015.0,Privately Held,"Duurzaam en klimaatneutraal datacenter, Value for Money, 24x7- continuiteit, Databeveiliging",,,
https://www.linkedin.com/company/1twente/,1Twente,201-500 employees,Broadcast Media,"Bij 1Twente hoor en zie je dagelijks de laatste actualiteiten uit Twente. Wij zijn te vinden op televisie, radio en online.",https://www.1twente.nl,2013.0,Nonprofit,"Radiostation, Televisiestation, Online media",Enschede,Overijssel,"Enschede, Overijssel"
https://www.linkedin.com/company/20face/,20face,11-50 employees,Computer Software,Privacy Proof Biometrics | GDPR Compliant,http://www.20face.com/,2016.0,Privately Held,"Face recognition R&D, Automated surveillance and security, Smart home applications, Automated identity verification and access-control",Enschede,Overijssel,"Enschede, Overijssel"
https://www.linkedin.com/company/24dutch-nl/,24dutch.nl,2-10 employees,Information Technology & Services,24dutch assists companies with IT services: IT Business Development or IT recruiting or IT purchasing,http://www.24dutch.nl,2001.0,Privately Held,"IT, Strategic Purchasing, Sales, Business Development, IT recruiting",Enschede,overijssel,"Enschede, overijssel"
https://www.linkedin.com/company/twenty-four-ict/,24ICT Projecten B.V.,2-10 employees,Information Technology & Services,De koers naar werkende ICT,http://www.24ict.nl,2008.0,Privately Held,"Onafhankelijk Advies, Project and processmanagement, Second opinion, Interim Management, Cloud Computing, Technische Consultancy en software ontwikkeling, Document management systemen",Barendrecht,Zuid Holland,"Barendrecht, Zuid Holland"
https://www.linkedin.com/company/25knots/,25Knots,0-1 employees,Information Technology & Services,"Freelance software engineer. Web development: PHP, Symfony, Drupal and managing development teams.",,2017.0,Self-Employed,"Drupal, PHP, Symfony, Behat, Webdevelopment",,,
https://www.linkedin.com/company/djurict/,2app,0-1 employees,Information Technology & Services,"2app provides full service web- and mobile application development services in cooperation with several business partners. 
Because our wide range of experience with platforms like Wordpress (CMS), Symfony 2 (for tailor-made web applications), OpenCart (webshops) and much more we can also help improve and/or rebuild your existing applications.",http://www.2app.nl,2008.0,Public Company,"Webdevelopment, Smartphone application development, Mac OS X support, mobile development, Responsive Web, Agile development, device agnostic, apps",Enschede,Overijssel,"Enschede, Overijssel"
https://www.linkedin.com/company/2bebetter/,2bebetter,0-1 employees,Computer Software,"Where you stop... we'll enter the game. 

Application development and market introduction of GPS2 (Golf Play Statistics using the Global Positioning System). A system that enables users to record their playing performance on the golf course, using the GPS2 Outdoor application on a weatherproof GPS receiver. And to upload these parameters into a webbased GPS2 Indoor application to be able to observe a round of golf previously played and to generate various trends based on large numbers of data.",http://www.2bebetter.com,,Privately Held,,,,
https://www.linkedin.com/company/2d3d/,2D3D.gratis,0-1 employees,Computer Software,Inspiratie en training in goede gratis software. Digitale creativiteit zonder de belemmering van taal en geld. #maakiets,https://www.2d3d.gratis/,2016.0,Nonprofit,,Zwolle,Overijssel,"Zwolle, Overijssel"
https://www.linkedin.com/company/2jours-on-line-bouwen/,2Jours B.V.,2-10 employees,Computer Software,De calculatiesoftware voor in de bouw.,http://www.2jours.nl,2006.0,Public Company,"Calculatie, Digitaal aanvragen, Planning, Facturatie, Bouw, Software",Raalte,Overijssel,"Raalte, Overijssel"
https://www.linkedin.com/company/2ran-solutions/,2RAN IT,2-10 employees,Information Technology & Services,"Z-Wave products are wireless communications products where convenience comes first. You can control devices via a controller (making a scene / rules), such as lights, door locks, sensors, etc. .. the possibilities are endless. - See more at: http://ranco.nl/z-wave-english/",http://ranco.nl/,2011.0,Self-Employed,"Fiber, FTTh, FTTx, Home/Business Automation, Z-Wave Products",Enschede,OV,"Enschede, OV"
https://www.linkedin.com/company/2xplain/,"2Xplain PayRoll, vakinformatie voor salarisprofessionals",11-50 employees,Information Services,"2Xplain is de specialist in informatievoorziening voor HR- en salarisprofessionals. Dat specialisme is geboren uit de overtuiging dat ons vakgebied veel te gecompliceerd is om aan generalisten over te laten. Eind 1997 waren het dan ook enkele vakgenoten zelf die het initiatief namen om de ingewikkelde regelgeving in begrijpelijke en heldere taal te gaan uitleggen. 

Nu, bijna 25 jaar later, heeft 2Xplain het grootste aanbod aan kennis- en vaardigheidstrainingen, een ruime keuze aan leergangen en vakopleidingen, een zeer complete online kennisbank met actuele regelgeving op het gebied van loonadministratie, arbeidsrecht, sociale zekerheid, pensioenen en internationale aspecten . Daarnaast vindt u in deze kennisbank altijd alle actuele bedrijfstak- en ondernemingscao’s. En ook het vakblad PayRoll Magazine, waarmee alles 20 jaar geleden begon, is nog altijd een hoog gewaardeerde, inmiddels grotendeels digitale informatiebron. De wekelijkse  PayRoll e-mailnieuwsbrief is voor LinkedIn-contacten geheel gratis.

De vakinformatie van 2Xplain

1. Vakopleidingen

PDL
VPS

2. Informatiebronnen

PayRoll Magazine Online
Online kennisbanken
   Inleiding recht
   Loonadministratie
   Pensioenen
   Arbeidsrecht
   Sociale verzekeringen
   Internationale aspecten
   CAO-databank

3. Bijscholen en up to date blijven

Het grootste aanbod aan praktijkgerichte studiedagen, vaardigheidstrainingen en leergangen, waarin tal van specifieke onderwerpen worden uitgediept.",https://www.2xplain.nl/payroll,1998.0,Educational Institution,"Vakinformatie voor HR- en salarisprofessionals and Studiedagen, leergangen en vakopleidingen voor HR- en salarisprofessionals",Deventer,Overijssel,"Deventer, Overijssel"
https://www.linkedin.com/company/360sportsintelligence/,360SportsIntelligence,11-50 employees,Computer Software,"360SportsIntelligence vindt dat iedere sporter die beter wil worden, ongeacht zijn of haar niveau, toegang moet hebben tot eigen beeldmateriaal. Naast prestatieverbetering draagt 360SportsIntelligence ook bij aan het vergroten van de sportbeleving, door zichtbaarheid in kantine en online. Dit biedt unieke content voor sponsoren, waardoor je als vereniging nieuwe inkomsten genereert.

360SportsIntelligence heeft een oplossing ontwikkeld waarbij gebruiksgemak, brede inzetbaarheid binnen de club en betaalbaarheid de uitgangspunten zijn. 360SportsIntelligence biedt een oplossing voor zowel de prestatieve als de recreatieve sporter. Hardware en software. Performance, entertainment én sponsormogelijkheden. All-in. Geen gedoe met individuele licenties, maar één abonnement voor de hele vereniging.",http://www.360sportsintelligence.com,,Public Company,,Enschede,Overijssel,"Enschede, Overijssel"
https://www.linkedin.com/company/3c--automatisering-bv/,3C+ Automatisering BV,2-10 employees,Computer Software,"3C+ Automatisering BV richt zich op bedrijven die werkzaam zijn in de Bouw - en de Constructieve sector. Door gebruik te maken van onze software, beschikken deze bedrijven over de juiste hulpmiddelen om meer grip en inzicht te krijgen in de eigen bedrijfsprocessen. Hierbij zal er efficienter gewerkt gaan worden en zal tevens de kwaliteit van het bedrijfsproces verbeteren. Onze medewerkers hebben al meer dan 10 jaar ervaring in het automatiseren van deze bedrijfsprocessen. Dankzij onze ervaring en flexibiliteit zijn wij heel goed in staat om hierbij op-maat oplossingen te bieden die zo goed mogelijk aansluiten op uw organisatie, wensen en behoeftes.",http://www.3cplus.nl,2010.0,Self-Employed,"Automatisering, Beton Prefab, Bouw, Constructief, Logistiek, ICT",,,
https://www.linkedin.com/company/4d-datalogic/,4D DataLogic B.V.,2-10 employees,Information Technology & Services,"4D DataLogic B.V. (hierna te noemen 4D)  is een automatiserings- en consultancybedrijf, gespecialiseerd in het automatiseren van administratieve en logistieke processen. Onze doelstelling is om uw bedrijfsprocessen te automatiseren en te optimaliseren, zodat u uw onderneming kunt sturen op uw prestatie-indicatoren. Wij geloven in een vierdimensionale aanpak waarbij wij uw administratieve en logistieke processen vanuit verschillende invalshoeken benaderen en automatiseren, met als ultieme doel waarde creëren voor uw onderneming.",http://Volgt,2015.0,Partnership,"ICT-consultancy, Advisering, Inrichten administratieve en logistieke processen, Automatisering",Tubbergen,Overijssel,"Tubbergen, Overijssel"
https://www.linkedin.com/company/4essence/,4essence,0-1 employees,Information Technology & Services,"4essence is an innovative company whose is operating in 3 core bussines area:

1- Exchang information systems: In the past 4 years we have develop a new methode and information system to predict the behavior of Exchang indices

2- Information Security: We offer simple and effective information security solutions

3- ICT maintenance service",http://www.4essence.com,2007.0,Sole Proprietorship,"Information Security, Innovation in ITC maintenance, Exchange information systems",,,
https://www.linkedin.com/company/4itprofessionals/,4IT Professionals BV,11-50 employees,Information Technology & Services,4IT Professionals is dé thuisbasis voor medewerkers en opdrachtgevers. Samen zorgen we voor groei en ontwikkeling.,http://www.4itprofessionals.nl,2010.0,Privately Held,"Functioneel Beheer, Informatiemanagement, Business Analyse, Informatie Analyse, Sourcing, Projecten, Outsourcing Functioneel & Technisch Beheer, Werving & Selectie, Recruiting, Deta-Vast, Scrum Master, LEAN, Devops, Process Analyse, agile",ZWOLLE,Overijssel,"ZWOLLE, Overijssel"
https://www.linkedin.com/company/weare52dn/,52DN | BERT,11-50 employees,Information Technology & Services,"Gespecialiseerd in het aandragen van creatieve, vernieuwende en relevante (IT)-oplossingen.",https://www.weare52dn.com/,2014.0,Public Company,Mobile Business Strategy and Mobile Apps development,Enschede,Overijssel,"Enschede, Overijssel"
https://www.linkedin.com/company/s-jdevelopment/,88 Days,0-1 employees,Information Services,Make your adventure endless,https://88-days.com,2018.0,Self-Employed,"Swift, Kotlin, Android, IOS, Wordpress, C",Brisbane,QLD,"Brisbane, QLD"
https://www.linkedin.com/company/9-knots-business-solution-ltd/,9 Knots Business Solutions,11-50 employees,Computer Software,Say hello to Perfect-Fit Solutions! 9 Knots is a provider of specialist solutions for companies with complex businesses.,http://www.9knots.co.uk,2003.0,Public Company,"case management, debt management, clinical trials / eCRF / EDC, IVA / Trust Deeds, bespoke solutions, sales force support, claims management, socal mobility software, crm software, software, specialty solutions, computer software, management software, perfect-fit",Mansfield,Nottinghamshire,"Mansfield, Nottinghamshire"
https://www.linkedin.com/company/1208819/,A Must in Every Office BV,2-10 employees,Computer Software,"Our goal is to help people all over the world in Excel.
We do this by providing a toolset called ASAP Utilities, which saves time and makes work in Excel much easier and quicker.

A Must in Every Office is owned by Bastien Mensink and the company's main purpose is to further develop, professionalize and promote the excel add-in ASAP Utilities. Bastien Mensink is also the author of ASAP Utilities.",https://www.asap-utilities.com,2007.0,Privately Held,time saving tools for Excel,Zwolle,Overijssel,"Zwolle, Overijssel"
https://www.linkedin.com/company/alextiehuis.nl/,A&A Appdesign,2-10 employees,Computer Software,"A&A Appdesign maakt maatwerk software. Het Nederlandse midden en kleinbedrijf wordt daarmee in staat gesteld zich te concentreren op waar ze goed in zijn.
Bedrijven kunnen excelleren in hun markt door gebruik te maken van software op maat.
A&A Appdesign zoekt voortdurend naar simpele oplossingen met maximale meerwaarde voor haar klanten. Er worden nieuwe methoden en technieken bedacht die leiden tot snelle, probleemloze softwareontwikkeling en daarmee lagere kosten.",https://www.aena-appdesign.nl,2012.0,Partnership,"CRM, tijdregistratie, materiaalregistratie projectregistratie, Apps, Webapplicaties",Enschede,Overijssel,"Enschede, Overijssel"
https://www.linkedin.com/company/a-j-s-interim-management-&-consultancy/,A-J-S interim management & consultancy,0-1 employees,Information Technology & Services,Wat kan ik voor u doen?,http://www.a-j-s.nl,,Self-Employed,,,,
https://www.linkedin.com/company/a.n.t.-international-b.v./,A.N.T. International B.V.,11-50 employees,Publishing,"A.N.T. International B.V. is a publishing company based out of Colosseum 22, ENSCHEDE, Netherlands.",,,,,,,
https://www.linkedin.com/company/a1b2c3-consultancy---hypnodokter/,A1b2c3 Consultancy - Hypnodokter,0-1 employees,Information Technology & Services,World Building,http://hypnodokter.com,2016.0,Sole Proprietorship,,Enschede,Overijssel,"Enschede, Overijssel"
https://www.linkedin.com/company/a3-online/,A3 online,2-10 employees,Information Technology & Services,Maak jaarplannen effectief en overzichtelijk met de A3 methodiek en A3 online,http://www.a3online.nl,,Partnership,,,,
https://www.linkedin.com/company/aaaa-beheergroep-b.v./,AAAA Beheergroep B.V.,11-50 employees,Computer Software,"AAAA Beheergroep B.V. is a computer software company based out of Veldhuisweg 4-10, IJHORST, Netherlands.",,,,,,,
https://www.linkedin.com/company/aaand8/,AAAnd8,0-1 employees,Information Services,"AAAnd8 begeleidt adviseert en coacht ondernemers op alle momenten in de levenscyclus van hun bedrijf: van pre/start, start tot verantwoorde bedrijfsbeëindiging en alles wat daar tussen zit met een max van 10 werknemers ook wel micro-ondernemers genoemd. Dit alles in goede en in slechte tijden. De ondernemer staat centraal. Met gemeentelijke organisaties en financiële instellingen wordt intensief samengewerkt. Onze experts beschikken over branche- en hebben regio deskundigheid op het gebied van ondernemerschap en zijn goed op de hoogte van zakelijke kredietverstrekking en microfinanciering.
AAAnd8 is ook de organisatie die u kunt inhuren voor het geven van trainingen en workshops aan de bovenstaande doelgroep. Wij geven o.a. training bij het UWV over Starten met behoud van uitkering. Wij verzorgen ondernemen in 4 avonden voor Gemeentelijke WWB afdeling klanten met een ondernemers idee.",http://www.aaand8.nl,2012.0,Self-Employed,"Ondernemen, Coaching, Advisering, Training",Almelo,Overijssel,"Almelo, Overijssel"
https://www.linkedin.com/company/aandagt-reclame-&-marketing/,Aandagt reclame & marketing,11-50 employees,Marketing & Advertising,"Reclame die altijd raakt!

Aandagt, het full-service reclame- en marketingbureau zorgt ervoor dat mensen verliefd worden op jouw merk. We ontwerpen elke dag – met liefde – unieke en creatieve communicatieconcepten, met maar één doel: succes. Met onze jarenlange ervaring, eigentijds denken en moderne mediamix worden jouw klanten in hun hart geraakt. Nieuwsgierig geworden? Bekijk onze aanpak op www.aandagt.nl en/of neem contact op met ons.
(0546) - 850 369  - info@aandagt.nl",http://www.aandagt.nl,2007.0,Public Company,"Advies, Conceptontwikkeling, Communicatiestrategie, Fotografie, Huisstijlontwikkeling, Illustratie, Marketing, Reclame, Websiteontwikkeling",Almelo,Overijssel,"Almelo, Overijssel"
https://www.linkedin.com/company/aankleding-en-inrichting-van-winkels-en-werkplekken/,Aankleding en inrichting van Winkels en werkplekken,,Graphic Design,Een levendige en sterke vormgeving begint met goed luisteren. Daarna volgt het creëren van een realistisch beeld en het waarmaken daarvan. Dat is Alfabet Reclame!,https://www.alfabetreclame.nl/,,,,,,
https://www.linkedin.com/company/abccalc/,ABCcalc,2-10 employees,Information Technology & Services,ABCcalc biedt in een Saas-omgeving het ABCcalc-kostprijsprijsmodel aan,http://www.abccalc.nl,2020.0,Partnership,,Denekamp,Nederland,"Denekamp, Nederland"
https://www.linkedin.com/company/abra-nl/,Abra B.V.,2-10 employees,Computer Software,Gebruiksvriendelijke software.,https://abra.nl,2014.0,Privately Held,"Android development, iOS development, Web development",Enschede,Overijssel,"Enschede, Overijssel"
https://www.linkedin.com/company/abrnd/,Abrnd,11-50 employees,Marketing & Advertising,"Abrnd is een innovatief brand management platform waarmee alle soorten bedrijven kunnen bouwen aan een waardevol merk. 

Ons hogere doel is om de wereld een stukje beter te maken door bedrijven in staat te stellen merken te bouwen die wat toevoegen aan deze wereld.",https://www.abrnd.com,2018.0,Privately Held,Branding and Brand Management,Deventer,Overijssel,"Deventer, Overijssel"
https://www.linkedin.com/company/access2data/,Access2Data,0-1 employees,Computer Software,Data analyse en ondersteuning,https://www.access2data.nl,2003.0,Self-Employed,"Maatwerk databases, Access, Kantoorondersteuning, Planning",Hengelo,Overijssel,"Hengelo, Overijssel"
https://www.linkedin.com/company/accnt/,accnt.,2-10 employees,Computer Software,99% nerdfree | 100% nerdproof,http://www.accntsoftware.nl,2020.0,Privately Held,,Zwolle,Overijssel,"Zwolle, Overijssel"
https://www.linkedin.com/company/accommodatiehuur.nl/,Accommodatiehuur (Accommodation rental),11-50 employees,Internet,"Accommodatiehuur offers an online reservation system and planning system. Our software is mainly used by sports complexes, tennis courts, squash courts, soccer- and sports fields and meeting rooms!",https://www.accommodatiehuur.nl,2015.0,Partnership,,Oldenzaal,Overijssel,"Oldenzaal, Overijssel"
https://www.linkedin.com/company/account-software/,Account Software Groep,11-50 employees,Computer Software,"Automatiseringsoplossingen voor finance, logistiek en ERP voor MKB en ZZP. Met trots onderdeel van Visma.",http://www.accountsoftware.nl,1990.0,Public Company,"AccountView Expert Center AVEC, AccountView support, AccountView implementatiespecialist, AccountView maatwerk, AccountView hosting, Elvy Document Scan , Visma.net Financials, Visma.net Logistics, Visma.net Project Accounting, Visma Advisor, Visma Financial Ov",,,
https://www.linkedin.com/company/accountancy-software-gemak/,Accountancy Gemak & Software Gemak,201-500 employees,Computer Software,Alles onder controle met de verrassend slimme softwareoplossingen van Accountancy Gemak & Software Gemak.,https://accountancygemak.nl/,1980.0,Privately Held,"Bedrijfssoftware, Software, Accountancy, MKB, ZZP, Ondernemer, Salaris, Payroll",,,
https://www.linkedin.com/company/accredis-b-v-/,Accredis B.V.,2-10 employees,Information Technology & Services,Accredis: kies voor betrouwbaar.,http://www.accredis.nl,2001.0,Privately Held,"Sluitende fiscale ritregistratie, Object bewaking, Fleetmanagement, kilometerregistratie",Enschede,Overijssel,"Enschede, Overijssel"
https://www.linkedin.com/company/acec-nederland-b.v./,Acec Nederland B.V.,2-10 employees,Computer Software,"This listing was automatically created by LinkedIn. This listing is not currently maintained by, endorsed by or affiliated with Acec Nederland B.V.. Learn more",http://www.acec-nederland.nl,,,,,,
https://www.linkedin.com/company/aceworks-nl/,AceWorks,2-10 employees,Computer Software,Aceworks is een groep gepassioneerde jonge ondernemers die goede webdesign betaalbaar wil maken.,https://www.aceworks.nl,2017.0,Privately Held,webdesign and webdevelopment,Hardenberg,Overijssel,"Hardenberg, Overijssel"
https://www.linkedin.com/company/achtereekte-ict-consultancy/,Achtereekte ICT consultancy,0-1 employees,Computer Software,,,2014.0,Self-Employed,,Deventer,Overijssel,"Deventer, Overijssel"
https://www.linkedin.com/company/acquire-publishing-bv/,Acquire Publishing,11-50 employees,Publishing,"Acquire Publishing is de grootste uitgever op het gebied van Architectuur, Ruimte en Mobiliteit.

Meer dan 30.000 Architectuur-, Ruimte- en Mobiliteitsprofessionals zijn al aangesloten bij onze titels.

Specialisten ontmoeten specialisten uit hun eigen vakgebied. En maken ook kennis met andere disciplines, afdelingen, overheden, adviesbureaus, (landschaps)architecten, aannemers, leveranciers, burgers en de maatschappij.

Om te praten over hun specifieke vraagstukken en over gezamenlijke thema's als participatie, duurzaamheid, bereikbaarheid en nieuwe financieringsmodellen.

Via onze websites, e-mailnieuwsbreiven, tweets, Facebook, Linkedin, magazines en evenementen.

Acquire publishing
aangenaam kennis maken",http://www.acquirepublishing.nl,,Privately Held,"uitgeven, evenementen, openbare ruimte, kennisproducten, ruimte, mobiliteit, architectuur, redactie",Zwolle,Overijssel,"Zwolle, Overijssel"
https://www.linkedin.com/company/acsense-it-support/,Acsense LLC,2-10 employees,Information Technology & Services,"Acsense supports commercial and government organizations with Marketing, Sales and IT. Acsense addition to its office in Ulaanbaatar also has a branch in the Netherlands.
These two branches are well connected to each other making it for our relationships also accessible to its product or service to export.

Please visit our website to get more info: www.acsense.mn",http://www.acsense.mn,2008.0,Self-Employed,"Marketing resource, Sales Support, IT Support, CRM, Software",Hardenberg,Overijssel,"Hardenberg, Overijssel"
