_url,name,company_size,industry,about_us,website,founded,company_type,specialties,headquarters_city,headquarters_province,headquarters
https://www.linkedin.com/company/roxit/,Roxit,51-200 employees,Computer Software,"Beslis Bewust met Impact Automation. Wij zijn actief in de business unit's VTH, RO, K&L en ECM",http://www.roxit.nl,,Privately Held,"Zaakgericht werken, Vergunningverlening, toezicht en handhaving, Ondergrond, Ruimtelijke Ordening, Geo, Overheid-IT, Veiligheidsregio's, Gemeenten, Omgevingsdiensten, Waterschappen, Provincies, Evenemenenvergunning, Geo-IT, Bodeminformatie, automatisering, VTH",Zwolle,Overijssel,"Zwolle, Overijssel"
https://www.linkedin.com/company/rozent/,Rozent,2-10 employees,Information Technology & Services,Hét ICT bedrijf van Zwolle,http://www.rozent.nl,,Self-Employed,,Zwolle,Overijssel,"Zwolle, Overijssel"
https://www.linkedin.com/company/rtv-noordoost-twente/,RTV Noordoost Twente,11-50 employees,Broadcast Media,"RTV Noordoost Twente levert inwoners in Noordoost Twente onafhankelijke en actuele informatie over de streek waarin zij leven via radio, televisie en internet.

De missie van onze organisatie:

Wij willen de primaire nieuwsbron zijn voor iedereen die wil weten wat er bij hem in de buurt gebeurt.
We werken integer, professioneel en compleet onafhankelijk.
Wij willen de beste en hoogst gewaardeerde nieuwsbron uit de regio zijn.",http://www.rtvnoordoosttwente.nl,2012.0,Public Company,"Streekradio, Tekst-TV, Internet, Noordoost Twente",,,
https://www.linkedin.com/company/rtv-raalte/,RTV Raalte,11-50 employees,Broadcast Media,"RTV Raalte is de lokale omroep van de gemeente Raalte. De gemeente Raalte kent twee hoofdkernen (Raalte en Heino) en 7 buurtdorpen (Heeten, Nieuw-Heeten, Mariënheem, Luttenberg, Laag Zuthem, Lierderholthuis en Broekland).

RTV Raalte is een vrijwilligersomroep, die met een groep enthousiaste medewerkers radio- en televisieprogramma's over en voor de gemeente Raalte maken. RTV Raalte brengt lokale gebeurtenissen bij u thuis, in beeld en geluid.

De gemeente Raalte is evenwel te klein om 24 uur lang lokaliteiten te kunnen brengen. Daarom heeft RTV Raalte Radio een raamprogramma, wat verzorgd wordt door RTV Oost. 

Radio, TV en internet
RTV Raalte is  actief om interessante lokale programma’s via radio en televisie te brengen. 

RTV Raalte Radio zendt 24 uur per dag uit. RTV Raalte TV zendt door de week, elk uur, op het halve uur uit. Op zondag worden tussen 11.30 en 12.30 de uitzendingen van de voorgaande week herhaald. Heeft u een uitzending gemist? Dan kunt u die nog bekijken via de website.

Blijvende steun
Om radio-programma’s en tv-registraties van de carnaval, de Stoppelhaene, de pompdagen en noem maar op, te kunnen blijven maken, is naast het enthousiasme van de vrijwilligers ook uw steun nodig. Met die steun kan RTV Raalte de programma’s blijven maken, waar u graag naar luistert en/of kijkt. U kunt de omroep steunen door donateur te worden voor €5,- per jaar.",http://www.rtvraalte.nl,,Nonprofit,,,,
https://www.linkedin.com/company/rtv-sternet/,RTV Sternet,51-200 employees,Broadcast Media,"RTV Sternet is al meerdere jaren het radio- en televisiestation van de gemeente Haaksbergen en omgeving. Dit wordt gedaan door het leveren van onafhankelijk nieuws, dat elke dag direct bij je thuis te horen en te zien is. Hierdoor onderscheidt RTV Sternet zich van andere stations.
 
Door samen de schouders eronder te zetten, hebben de medewerkers van RTV Sternet zich door de jaren weten te profileren in de Haaksbergse samenleving. Door de goede samenwerking tussen de vrijwilligers behoudt RTV Sternet haar status als frisse en dynamische organisatie, die streeft naar vernieuwingen.",http://www.rtvsternet.nl,2001.0,Nonprofit,"Radio, Televisie, Internet, Nieuws",,,
https://www.linkedin.com/company/ruim/,Ruim,11-50 employees,Marketing & Advertising,"RUIM is de thuishaven voor creatieve ondernemers, die vanuit verbouwde zeecontainers hun klanten bedienen. Daarnaast werken ze samen aan mooie projecten. RUIM biedt unieke werkplekken en een dynamische werkomgeving. RUIM brengt creativiteit samen.",http://www.ruimvolcreatieven.nl,2021.0,Partnership,,Hardenberg,Overijssel,"Hardenberg, Overijssel"
https://www.linkedin.com/company/rustyice-solutions/,Rustyice Solutions,11-50 employees,Computer Networking,"The complete provider of market leading business
telecommunications and ICT services.

Why Rustyice ? 

At Rustyice Solutions, we are passionate about technology.

With satisfied customers from every market sector and of every size from home networks to distributed corporate networks all accross the UK we have been providing a cost-effective service with unrivaled account management and customer care throughout the UK since 1998.

We take pride in the network engineering excellence which characterises everything we do. As the network matures and the services it delivers become increasingly essential to ordinary life we know you need your complex systems to work first time every time. Our proactive customer service and unrivalled standards ensure that you are always in control and, continue to enjoy the quality of service and more crucially the cost reductions which technology can bring to your home or business.

We do understand that we need to earn your respect however and are always willing to discuss introductory pricing in order to reflect this. So come on, get in touch and let us show you just how much we can bring to the mix. Agile and independent, we can and will impress.",http://www.rustyice.co.uk,1998.0,Privately Held,"Enterprise Networking, Small Business Networking, Home Networking, Data (LAN and WAN), Voice Networks, Video Networks, Physical and Network Security, Web Services, Cloud Computing, Network Management, Project Management, Critical Infrastructure",Kilmarnock,East Ayrshire,"Kilmarnock, East Ayrshire"
https://www.linkedin.com/company/ruvano/,Ruvano Document Solutions B.V.,2-10 employees,Information Technology & Services,"Optimaliseer je documentprocessen en bespaar daarmee afdrukkosten, tijd en ergernissen",http://www.ruvano.nl,1910.0,Privately Held,"Printer oplossingen, Plot oplossingen, Toners, scanoplossingen, Kyocera, Beveiligd printen, Follow me printing, scannen naar Modality, scannen naar Afas, scannen naar OneDrive, documentstromen, labelprinters, Multifunctionals, Workflow, onderhoud en reparatie, koop",Almelo,overijssel,"Almelo, overijssel"
https://www.linkedin.com/company/ruwise/,RUwise,0-1 employees,Computer Software,"RUwise is a consultancy firm specialized in the verification and validation of (concurrent) software systems. We are experts in the model checker SPIN and know how to apply the tool to find bugs in high level designs of software. We also have experience in verifying software programs written in Java, C# and C.",http://www.ruwise.nl,,Privately Held,,,,
https://www.linkedin.com/company/rysst/,RYSST,11-50 employees,Information Technology & Services,Talentvolle programmeurs met creatieve ideeën en innoverende technieken,http://www.rysst.nl,2016.0,Privately Held,,Zwolle,Overijssel,"Zwolle, Overijssel"
https://www.linkedin.com/company/rysst-b.v./,RYSST B.V.,11-50 employees,Publishing,"RYSST B.V. is a publishing company based out of Eekwal 18, ZWOLLE, Netherlands.",http://www.rysst.nl,,,,,,
https://www.linkedin.com/company/s-a-syntaxis/,S.V. Syntaxis,"501-1,000 employees",Computer Software,"S.V. Syntaxis is de IT-studievereniging van de academie ACT (voormalig CII) op de Saxion Hogeschool Enschede. Herbergzaam voor leden van Informatica, Technische Informatica, Bedrijfskundige Informatica, IT Service Management, Gaming Technology en Game Creation.",http://www.syntaxis.nl,1982.0,Public Company,,Enschede,Overrijssel,"Enschede, Overrijssel"
https://www.linkedin.com/company/saddle-up-nl/,Saddle Up,2-10 employees,Information Technology & Services,Veilig en betrouwbaar je paardenspullen kopen en verkopen,http://www.saddleup.nl,2019.0,Privately Held,,,,
https://www.linkedin.com/company/safety-software-solutions/,Safety Software Solutions,2-10 employees,Computer Software,Laat je verrassen door de mogelijkheden van de Safety Suite,https://www.safetysuite.nl,2016.0,Public Company,"ERP, CRM, Development, Sofware, Mobiele oplossing, Totaaloplossing, Safety Suite, Consultancy",Oldenzaal,Overijssel,"Oldenzaal, Overijssel"
https://www.linkedin.com/company/safetyschool/,Safetyschool,11-50 employees,E-learning,Wil jij ook een erkend EHBO- of BHV diploma of certificaat behalen in een halve dag? Wij bieden onze cursussen aan voor groepen (of individueel) op diverse locaties in Nederland. Er is altijd wel een locatie bij jou in de buurt!,https://safetyschool.nl/,1998.0,Privately Held,,Meppel,Drenthe,"Meppel, Drenthe"
https://www.linkedin.com/company/sale4all/,Sale4All,51-200 employees,Telecommunications,Sale4All is een netwerk van contactcenters gespecialiseerd in sales.,http://www.sale-4-all.nl,,Privately Held,,Deventer,Overijssel,"Deventer, Overijssel"
https://www.linkedin.com/company/feite-bakker-sales-as-a-service/,Sales As A Service ICT& Healthcare,0-1 employees,Information Technology & Services,Hét alternatief voor Fulltime Sales (New Busines). Specialisme: Telefonische leadgeneratie/ kwalificatie.,https://www.feitebakkersales.nl,2018.0,Self-Employed,,Hengelo,Overijssel,"Hengelo, Overijssel"
https://www.linkedin.com/company/salesdock-nl/,Salesdock,11-50 employees,Information Technology & Services,Waar sales en klantcontact samen komen.,https://salesdock.nl,2018.0,Privately Held,"sales, omnichannel, crm, callcenter",Enschede,Overijssel,"Enschede, Overijssel"
https://www.linkedin.com/company/salesforce1_2/,SalesForce1,0-1 employees,Computer Software,intermediair Amsterdam.,http://www.salesforce-1.nl,,Self-Employed,,,,
https://www.linkedin.com/company/saleshelden/,Saleshelden,11-50 employees,Marketing & Advertising,Met Account Based Sales genereer je betere leads en verkort je de salescyclus. Ontdek een nieuwe weg om potentiële klanten te ontmoeten in het moderne sales tijdperk. Win met een persoonlijke b2b sales strategie. Kies voor Account Based Sales.,http://www.saleshelden.nl,2014.0,Public Company,Account Based Sales,Enschede,Overijssel,"Enschede, Overijssel"
https://www.linkedin.com/company/sallandelectronics/,SallandElectronics,11-50 employees,Information Technology & Services,Your partner in IoT Solutions,http://www.sallandelectronics.nl,1998.0,Privately Held,"Embedded Systems, Wireless solutions, M2M, Low power electronics, Wireless Sensor Networks, Internet of Things, IoT",Zwolle,Overijssel,"Zwolle, Overijssel"
https://www.linkedin.com/company/sallandis/,Sallandis,0-1 employees,Information Technology & Services,"Sallandis is een eenmansbedrijf dat gespecialiseerd is in Java Software ontwikkeling. Met name J2EE webapplicaties zijn een specialisme van Sallandis.

Sallandis heeft veel ervaring opgedaan bij grote bedrijven als Kluwer, Belastingdienst en Achmea.",http://www.sallandis.nl,2008.0,Self-Employed,Java J2EE Freelance,,,
https://www.linkedin.com/company/sallandius/,Sallandius,2-10 employees,Information Technology & Services,"Sallandius is een onderneming die het belangrijk vindt technici samen te brengen en kennis en ervaringen uit te wisselen. Wij richten ons op de senior technisch professional. Onze core business is IT infrastructuur, cloud, virtualisatie, automation, orchestration, application delivery & mobility.",http://www.sallandius.nl/,2016.0,Privately Held,"Advisering & Reviews, Implementatie, Training & Troubleshooting, Architectuur & Ontwerp, Second opinions, Citrix NetScaler, Citrix XenApp, Citrix XenDesktop, Citrix XenMobile, Microsoft Core Infra, VMWare AirWatch, Microsoft Azure / Public Cloud",Raalte,Overijssel,"Raalte, Overijssel"
https://www.linkedin.com/company/salutaris/,Salutaris,2-10 employees,Information Technology & Services,"Salutaris V.O.F. is een klein automatiseringsbedrijf dat zich richt op het midden en klein bedrijf. Ze is opgericht door drie studenten van de Universiteit Twente. Zij hadden als doel een fexibel werkende helpdesk op te richten die gericht is op werkplekondersteuning voor een grote afdeling van de Universiteit. Inmiddels heeft Salutaris ook een aantal andere klanten en blijft zoeken naar nieuwe uitdagingen. Als u wilt weten wat Salutaris voor uw bedrijf kan betekenen kijkt u onder het kopje diensten of neemt u direct contact met ons op, zie het kopje contact.",http://www.salutaris.nl,2001.0,Privately Held,"IT Support, IT Automation, Servicedesk",,,
https://www.linkedin.com/company/state-of-the-art-marketing-event/,SAM event,11-50 employees,Marketing & Advertising,"De 13e editie van het State of the Art Marketingevent staat in het teken van de Customer Journey of Tomorrow. De reis van de klant is een belangrijk thema in de marketing. Een Customer Journey geeft een zo gedetailleerd mogelijke weergave van de spreekwoordelijke reis die een consument aflegt alvorens hij klant wordt en daadwerkelijk een product of dienst afneemt. 
Bedrijven en studenten worden in deze editie van het Sam Event geïnformeerd over hoe zij hun Customer Journey future proof kunnen maken. Dit aan de hand van interessante sprekers en leerzame workshops en masterclasses. 

Naast de kennis die je opdoet, is er na afloop van het event de gelegenheid om in contact te komen met studenten en bedrijven uit de regio Zwolle. Het belooft een inspirerende dag te worden met kennis van het hoogste niveau.",https://samevent.nl/,2009.0,Educational Institution,"Marketing, Netwerken, Trends, Innovatief, Samenwerken",Zwolle,Overijssel,"Zwolle, Overijssel"
https://www.linkedin.com/company/samnederland/,SAM Nederland,2-10 employees,Computer Software,A License check a day Keeps the audit away.,http://www.samnederland.nl,2011.0,Privately Held,"Software Asset Management, Contract Management, SAM Tooling, Software Audits, Software License, SAM as a Service, Vendor Management, SAM Nederland – Dé onafhankelijk SAM partij, Onafhankelijk, transparant en deskundig",Zwolle,Overijssel,"Zwolle, Overijssel"
https://www.linkedin.com/company/samen-in-nood-steenwijkerland/,Samen in nood Steenwijkerland,2-10 employees,Information Services,Komt het voortbestaan van uw bedrijf in gevaar? Als mede-ondernemers helpen wij u graag.,https://sameninnood.nl,,Nonprofit,,Steenwijk,Overijssel,"Steenwijk, Overijssel"
https://www.linkedin.com/company/sarthro-travelbags-b.v./,Sarthro Travelbags B.V.,11-50 employees,Internet,"Sarthro Travelbags B.V. is an internet company based out of Korte Spruit 25, HARDENBERG, Netherlands.",http://www.travelbags.nl,,,,,,
https://www.linkedin.com/company/time4less/,SaverIT,2-10 employees,Information Services,Attendance registration with Corona Camera for construction sites,https://www.saverit.net,2017.0,Privately Held,,Steenwijk,Overijssel,"Steenwijk, Overijssel"
https://www.linkedin.com/company/say-yeah-motion-media/,Say Yeah Motion Media,11-50 employees,Broadcast Media,"Say Yeah Motion Media is specialist in beeldcommunicatie. Ons bedrijf specialiseert zich in audiovisuele producties die gekenmerkt worden door combinaties van video, animatie, muziek, vormgeving en voice-over. Samen met onze klant kunnen wij uw boodschap op een zo aantrekkelijk mogelijke wijze visualiseren en communiceren.",http://www.sayyeah.nl,2000.0,Public Company,"Film, Animation, Storytelling, Livestream",,,
https://www.linkedin.com/company/scalar-data/,Scalar Data B.V.,2-10 employees,Information Technology & Services,"We focus on the design, technology and strategy behind big data- and iot solutions.

We have the resources and in-house skills to bring our clients ideas to life quickly, reliable and with the highest quality. We are breathing Open Source software since we believe our clients will benefit from the speed in innovation and quality of the solution at a fraction of the costs of proprietary software. Money that can be spent to drive our clients innovations. Since some of our clients did invest in proprietary software we also have expertise in some proprietary solutions.",https://scalardata.nl,2016.0,Privately Held,"big data, internet of things, hadoop, spark",Deventer,Overijssel,"Deventer, Overijssel"
https://www.linkedin.com/company/scholte-van-mast-advies/,Scholte van Mast Advies,2-10 employees,Information Technology & Services,Meerwaarde creeren,http://www.scholtevanmast.com,2015.0,Privately Held,,Deventer,Overijssel,"Deventer, Overijssel"
https://www.linkedin.com/company/searchflow-nl/,Searchflow Online Marketing,11-50 employees,Internet,"Searchflow is een full-service online marketing partner die bedrijven helpt met het behalen van online resultaat. Wij leveren hoogwaardige en innovatieve diensten die nodig zijn om doelgroepen te bereiken, merkbekendheid op te bouwen en online rendement te genereren en te verbeteren. 

Ons ervaren team is onder andere gespecialiseerd in: online strategie, SEO, SEA, remarketing, conversie verbetering, emailmarketing, social media advertising en web ontwikkeling. Onze online marketingcampagnes zijn op maat en volledig afgestemd op de unieke doelen en behoeften van onze klanten. 

Wij weten wat er voor nodig is om bedrijven online te laten groeien. Maak kennis met Searchflow, een online marketing partner die oprecht om zijn klanten geeft. ",https://www.searchflow.nl,2015.0,Privately Held,"Website optimalisatie, Zoekmachine optimalisatie, Google AdWords, Conversie optimalisatie, Content optimalisatie, Social Media marketing",,,
https://www.linkedin.com/company/second-media-europe/,Second Media Europe,11-50 employees,Internet,"Internet stores in stocklots and refurbished goods 

For the moment in Holland, Denmark, Sweden the stores are open. The coming months also France, Germany and Poland.

Second Media have franchise structure on country level.

The central warehouse is located in Holland.",http://www.secondmedia.eu,2006.0,Privately Held,retail,,,
https://www.linkedin.com/company/sectorictsupport/,"Sector, First Class ICT Support",11-50 employees,Computer Networking,"Sector, First Class ICT Support richt zich volledig op dagelijkse ondersteuning van professionele computergebruikers.",https://support.sector.nl,1999.0,Sole Proprietorship,"IT Support, IT Helpdesk, Cloud Computing Support, Microsoft 365, Office 365, Workspace 365",Raalte,Overijssel,"Raalte, Overijssel"
https://www.linkedin.com/company/seeders/,Seeders,11-50 employees,Marketing & Advertising,"Digitale zichtbaarheid is de basis van een succesvolle online strategie. Seeders is gespecialiseerd in precies dat: zorgen dat jouw merk zichtbaar wordt op het digitale platform. Dit doen wij door middel van linkbuilding, SEO, SEA, social advertising en e-mail campagnes. Als Nederlands bedrijf, opereren we natuurlijk op de binnenlandse markt, maar met ons uitgebreide netwerk hebben we zelfs de mogelijkheid om zichtbaarheid te genereren op alle Europese markten!",http://www.seeders.nl,2012.0,Sole Proprietorship,"SEO, linkbuilding, Google Ads, E-mailmarketing, Growth Hacking, International SEO",Zwolle,Overijssel,"Zwolle, Overijssel"
https://www.linkedin.com/company/sellabees/,Sellabees,11-50 employees,Marketing & Advertising,"We ondersteunen jouw bedrijf op het gebied van omzetverhoging, naamsbekendheid en vindbaarheid.",https://www.sellabees.nl,2020.0,Privately Held,Google optimalisatie and Facebook adverteren,Hengelo,Overijssel,"Hengelo, Overijssel"
https://www.linkedin.com/company/sen-app/,SEN-app,2-10 employees,Information Technology & Services,De Smart Educational Network webapp is gericht op het wegnemen van administratieve rompslomp in techniek onderwijs.,https://sen-app.nl,2018.0,Privately Held,"blockchain, onderwijs, vmbo, mbo, IT-oplossingen, Data, Compliance, informatie, informatietechnologie, opleiding, app development, projectmanagement, netwerkapplicatie, keuzevakken, docenten, leerlingen, leerbedrijven, opleidingsbedrijven",Deventer,Overijssel,"Deventer, Overijssel"
https://www.linkedin.com/company/senator-benelux/,Senator Benelux,11-50 employees,Marketing & Advertising,"Wanneer iemand in Duitsland zoekt naar een balpen welke vervaardigd is in Duitsland, zal dat zeer waarschijnlijk een  senator® balpen zijn. We hebben meer dan 90 jaar ervaring in het vervaardigen en bedrukken van schrijfwaren. Onze inventiviteit en nauwe samenwerking met onze klanten betekent dat in Duitsland de naam senator® synoniem staat voor balpen.",https://www.senator.com/nl_nl/,1920.0,Privately Held,,AX Borne,Netherlands,"AX Borne, Netherlands"
https://www.linkedin.com/company/senza-mobile/,Senza Mobile,11-50 employees,Telecommunications,Hoogwaardig echt leren smartphonehoesjes van Senza. Deze handgemaakte smartphonehoesjes geven een luxe uitstraling aan je telefoon. De Senza hoesjes zijn verkrijgbaar in diverse kleuren en modellen en geschikt voor verschillende typen en modellen telefoons. Daarnaast levert Senza ook luxe datakabels afgewerkt met echt leder en screenprotectors. ,,,,smartphonehoesjes,Hengelo,Overijssel,"Hengelo, Overijssel"
https://www.linkedin.com/company/service-ict/,Service-ICT,2-10 employees,Information Technology & Services,"Wie zijn wij!
Service ICT is opgericht in 2005 en bestaat bijna 15 jaar. 
Wij ondersteunen klanten op het gebied van ICT, website ontwerpen/optimalisatie, printers leveren en het aansluiten van telefonie bij u.
Onze kracht is het voorkomen van problemen en het denken in oplossingen, zodat u als organisatie altijd door zou kunnen blijven doorwerken.

Visie!
Service-ICT  bestaat uit vakkundige experts die zorg dragen voor de ICT oplossingen binnen organisaties.",http://www.service-ict.nl,2005.0,Sole Proprietorship,"Systeembeheer, Netwerkbeheer, Verkoop en onderhoud van hard en software, Zakelijk internet en VoIP telefonie, Wordpress CMS & Hosting",Slagharen,OV,"Slagharen, OV"
https://www.linkedin.com/company/service4it/,SERVICE4IT,2-10 employees,Computer Software,Service voor IT zoals jij het wilt!,https://www.service4it.nl,2008.0,Partnership,,Goor,Overijssel,"Goor, Overijssel"
https://www.linkedin.com/company/seven-stars-b.v./,Seven Stars B.V.,11-50 employees,Publishing,"Seven Stars B.V. is a publishing company based out of Emmastraat 4, ZWOLLE, Netherlands.",http://www.seven-stars.nl,,,,,,
https://www.linkedin.com/company/seventerra-nederland-b.v./,SevenTerra Nederland B.V.,0-1 employees,Computer Software,"This listing was automatically created by LinkedIn. This listing is not currently maintained by, endorsed by or affiliated with SevenTerra Nederland B.V.. Learn more",,,,,,,
https://www.linkedin.com/company/sf-dynamics-consultancy/,SF Dynamics Consultancy,0-1 employees,Information Technology & Services,"Speaking the language of the customer and understanding the business processes of the customer are the basis for a good ERP Implementation.
SF Dynamics Consultancy offers consultancy for implementation and software selection with focus on finance processes, based on experience in several finance roles in multiple organizations.
Specialized in Microsoft Dynamics AX and Microsoft Dynamics 365 for Finance and Operations solution, with over more than 6 years experience in implementing Dynamics ERP solutions.

Freelance Consultancy in Dynamics ERP Implementations:
• Supporting project implementation team through partner or end user organizations;
• Analyzing and document business processes;
• Develop blue prints in translating business processes to ERP systems (focus Microsoft Dynamics 365);
• Requirements analysis, fit/gap analysis, functional design and test custom solutions;
• Educating key users and end users;
• Hypercare and after golive support.",https://www.sfdynamicsconsultancy.com,2018.0,Self-Employed,,Markelo,Overijssel,"Markelo, Overijssel"
https://www.linkedin.com/company/shallb/,ShallB,0-1 employees,Computer Software,"Gericht op het optimaliseren en vereenvoudigen van (bedrijfs-)processen met behulp van slimme, praktische software.",http://www.shallb.com/,2012.0,Sole Proprietorship,,Oldenzaal,Overijssel,"Oldenzaal, Overijssel"
https://www.linkedin.com/company/sheetwisenl/,Sheetwise,0-1 employees,Information Technology & Services,Voor al uw spreadsheet uitdagingen,http://www.sheetwise.nl,2019.0,Self-Employed,,Enschede,Nederland,"Enschede, Nederland"
https://www.linkedin.com/company/sheph-it-solutions/,Sheph IT Solutions,2-10 employees,Information Technology & Services,You grow!,http://www.sheph.nl,2019.0,Partnership,"E-Commerce, Odoo, Perfion, Tecdoc, PowerBI, PIM, ERP, ETL, Automotive, WordPress, Talend, Website, TecAlliance, TecCom, WooCommerce, RAI, CRM, Projectmanagement, Data, TransSmart",Rouveen,Overijssel,"Rouveen, Overijssel"
https://www.linkedin.com/company/shock-media-bv/,Shock Media B.V.,11-50 employees,Internet,"Shock Media is sinds 1999 gespecialiseerd in Managed Hosting. Met opdrachtgevers uit het MKB tot multinationals en overheden is Shock Media één van de grootste Managed Hosters van Nederland. 

Alle kennis is in-house beschikbaar en Shock Media kan daarom 100% onafhankelijke en specialistische ondersteuning bieden bij alle hostingvraagstukken. ",https://www.shockmedia.nl/,1999.0,Privately Held,"Hosting, domainnames, server-management, network-management, cloud computing, colocation, backup-solutions, server-colocation, dedicated-servers, virtual-servers, Linux-solutions, Unix-solutions, Windows-solutions, managed hosting, firewalls, storage-solutions, ",,,
https://www.linkedin.com/company/shopforce/,Shopforce,2-10 employees,Information Technology & Services,"Schaalbare en betaalbare e-commerce technologie, en diensten, om vraag en aanbod lokaal succesvol te kunnen verbinden",http://www.shopforce.nl,2013.0,Privately Held,e-commerce,Zwartsluis,Overijssel,"Zwartsluis, Overijssel"
https://www.linkedin.com/company/shortsey/,Shortsey,2-10 employees,Computer Software,"Gemakkelijk, Winkelen",https://www.shortsey.com,2019.0,Partnership,,,,
