_url,name,company_size,industry,about_us,website,founded,company_type,specialties,headquarters_city,headquarters_province,headquarters
https://www.linkedin.com/company/kaartje2go-nl/,Kaartje2go,51-200 employees,Internet,"Fotokaarten, uitnodigingen, wenskaarten, kerstkaarten en nog veel meer! 
Je maakt ze gemakkelijk en snel via kaartje2go.nl. 

Personaliseer jouw kaartje met eigen foto, tekst of handschrift.
Al meer dan 1.000.000 tevreden klanten gingen je voor!

Erkend door:

- TROS Radar:   Warme Douche  voor beste klantentevredenheidsservice.  (2015)
- Deloitte Fast50 :  In de top 5 van snelst groeiende technologiebedrijven.   (2012)
- VARA Kassa:   Wederom als beste online kaartenaanbieder getest  (2011)
- Consumentenbond:  Als beste online kaartenaanbieder getest    (2008)

Wij zijn vaak op zoek naar nieuwe medewerkers om ons snel groeiende team te versterken!

Wil jij in een gedreven team werken aan steeds weer nieuwe uitdagingen? 
Ben jij een teamspeler, die het leuk vindt om in een dynamische omgeving te werken?

Neem dan een kijkje op onze vacaturepagina: https://www.kaartje2go.nl/vacatures",https://www.kaartje2go.nl,2006.0,Privately Held,"wenskaarten, geboortekaartjes, trouwkaarten, uitnodigingen, fotokaarten, verhuiskaarten, kerstkaarten",,,
https://www.linkedin.com/company/kafkar/,Kafkar,0-1 employees,Information Technology & Services,"Zo’n 80% van alle software toepassingen is te realiseren met standaardsoftware. Voor de overige 20% is dit lastiger of niet mogelijk. Voor deze situaties zijn er maatwerk oplossingen nodig.
Wanneer het gaat om technische maatwerk oplossingen, dan kan Kafkar u daarmee helpen. Neem vrijblijvend contact op met Kafkar om te kijken of Kafkar u kan helpen bij de realisatie van dit maatwerk.",http://www.kafkar.nl,2005.0,Sole Proprietorship,,Enschede,Overijssel,"Enschede, Overijssel"
https://www.linkedin.com/company/karmacmr/,KarmacM&R,11-50 employees,Information Technology & Services,"Altijd en overal uw fysieke archief, digitaal beschikbaar!",https://karmacmr.nl/,2005.0,Privately Held,"Archiefbeheer, Archiefopslag, Archiefbewerken, Digitaliseren, Archiefverhuizing, AVG, GDPR, Archief vernietigen",Lelystad,Flevoland,"Lelystad, Flevoland"
https://www.linkedin.com/company/250683/,KCI World - Good Company,51-200 employees,Publishing,"KCI World is a technology driven, independent media and information group. The company is a market leader in processing and delivering technical information with a high added value for the global flow control communities in the process industries. Famous brands include Stainless Steel World, Valve World, Pump Engineer, Hose and Coupling World and Managing Aging Plants.

KCI’s portfolio contains over 120 media and 32 powerful labels with business in more than 80 countries worldwide. Founded in 1989, the company has achieved healthy annual growth and continues to further expand its products and services in Europe, the Americas, Middle East and Asia. 

KCI World has created a powerful suite of communication tools, ranging from printed media, websites, online, research & intelligence, to conferences, exhibitions and training courses. With the company’s multimedia concept and multi-cultural staff working in offices in The Netherlands, Germany, Canada, China and India, KCI continues to develop solutions for all customers active in the global flow control industries. ",http://www.kci-world.com,1989.0,Privately Held,"Online, Live, Print, Research, Flow Control, valves & actuators, stainless steel, pumps, managing aging plants, fugitive emissions, Hose & Coupling",Velp,Gelderland,"Velp, Gelderland"
https://www.linkedin.com/company/keenondots/,Keenondots,11-50 employees,Information Technology & Services,Power your Subscription Commerce,https://keenondots.com,2002.0,Privately Held,"Cloud Services, Managed Services, Cloud Platform, Integration Services",Enschede,Overijssel,"Enschede, Overijssel"
https://www.linkedin.com/company/kendis-ict-groep-nederland/,Kendis Digitale Oplossers,11-50 employees,Information Technology & Services,"Een efficiënte digitale werkomgeving creëren en alles wat daarbij komt kijken, dat is wat wij doen.",http://www.kendis.nl,2001.0,Privately Held,,Hardenberg,Overijssel,"Hardenberg, Overijssel"
https://www.linkedin.com/company/kennisplatform-ict/,Kennisplatform ICT,2-10 employees,Information Technology & Services,Dé onafhankelijke ICT vergelijker.,https://kennisplatform-ict.nl/,,Privately Held,,,,
https://www.linkedin.com/company/kerkdienstgemist/,Kerkdienstgemist,2-10 employees,Information Technology & Services,Wij helpen kerken om mensen op afstand te betrekken bij de kerk met online kerkradio- en -televisie uitzendingen.,https://kerkdienstgemist.nl,,Privately Held,,Deventer,Nederland,"Deventer, Nederland"
https://www.linkedin.com/company/kgbureau/,KG Bureau,11-50 employees,Marketing & Advertising,"KG Bureau is het online marketing bureau binnen de KG Online Marketing groep. Hier kun je jouw werkzaamheden uitbesteden aan echte specialisten. www.kgbureau.nl

KG Bureau levert de volgende diensten:

- Consultancy
- Adverteren: Google AdWords, Bing, Social Media Adverteren, Feedmarketing
- Organisch (SEO): Zoekmachineoptimalisatie, website review, website ondersteuning, website migratie, Google penalty
- Populariteit
- Conversieoptimalisatie
- Google Analytics 

Andere onderdelen van KG Online Marketing:

KG Blog (karelgeenen.nl): met artikelen over online marketing, wat zich onderscheid door de toegankelijke en praktische artikelen over online marketing, die ondernemers en marketeers helpen en aansporen tot actie, www.karelgeenen.nl. Op LinkedIn: https://www.linkedin.com/company/karelgeenen-nl

KG Academy: E-learning cursussen over online marketing voor als je meer praktische kennis in huis wilt halen: www.kgacademy.nl",http://www.kgbureau.nl,2005.0,Privately Held,"Internet Marketing, Online Marketing, Google AdWords (SEA), Online Adverteren, Zoekmachine Optimalisatie (SEO), Google Analytics, Social Media Marketing, Facebook Marketing, Conversie Optimalisatie, Content Marketing, Website review, Website migratie",Deventer,Nederland,"Deventer, Nederland"
https://www.linkedin.com/company/kgom-nl/,KGOM,11-50 employees,Marketing & Advertising,"KGOM = Karel Geenen Online Marketing. Met onze online marketing kennis helpen wij ondernemingen om online succesvol te zijn. Dit doen wij door online marketing toegankelijk te maken voor elke ondernemer.

Op onze blog vind je wekelijks artikelen over allerlei online marketing vraagstukken. Daarnaast vind je op onze website diverse handleidingen en downloads waarmee je direct zelf aan de slag kunt. Heb je wat hulp nodig? Met onze online marketing cursussen en workshops helpen we je op weg. 

Wil je je online marketing uitbesteden? Wij gaan samen met jou terug naar de basis en helpen je om een goede fundering op te zetten. Hiervoor hanteren wij de principes uit ons succesmodel, waarbij we in een 180-dagen traject met je aan de slag gaan. 

Meer weten? https://www.kgom.nl/",https://kgom.nl,2006.0,Privately Held,"Online marketing strategie en consultancy, Organisch (Zoekmachineoptimalisatie, website review, website ondersteuning, website migratie, Google penalty), Online Advertising (Google AdWords, Bing, Social Media Adverteren), Conversie optimalisatie, Strategie, Goo",,,
https://www.linkedin.com/company/kickbit/,KickBit,2-10 employees,Information Technology & Services,"Je hebt een idee. Of een probleem. En je hebt IT nodig voor de oplossing. Je wilt snel resultaat. En heldere afspraken.

Wij hebben kennis. Jaren ervaring. We houden van uitdagingen. Begrijpen snel. En handelen daarnaar.",http://www.kickbit.nl,,,,Vinkenbuurt,Overijssel,"Vinkenbuurt, Overijssel"
https://www.linkedin.com/company/kids-learning/,Kids Learning NL,11-50 employees,Publishing,"Kids Learning b.v. is een educatieve uitgeverij die gespecialiseerd is in het produceren en uitgeven van onderwijs materiaal die geschikt zijn voor het primair onderwijs, voortgezet onderwijs, hoger onderwijs en de kinderopvang. Ons onderwijsmateriaal staat bekend om goede kwaliteit in combinatie met hoogwaardige educatieve (toegevoegde) waarde.

Heeft u zelf een productidee of heeft u een product ontwikkeld en wilt u dit met ons delen of dit onder eigen label op de markt brengen?  Wij adviseren en begeleiden u in zowel het ontwikkeltraject als in het productieproces bij één van onze relaties. 

Informeer naar onze mogelijkheden, wij helpen u graag!",http://www.kidslearning.nl,2019.0,Privately Held,,Goor,Overijssel,"Goor, Overijssel"
https://www.linkedin.com/company/kidskonnect/,KidsKonnect,51-200 employees,Computer Software,Taking care of childcare,http://Kidskonnect.nl,2019.0,Privately Held,,Kampen,Overijssel,"Kampen, Overijssel"
https://www.linkedin.com/company/kiek-uut/,Kiek uut!,0-1 employees,Information Technology & Services,"Kiek uut! is opgericht door Niek Bunskoek, een tukker uit Twente. Kiek uut! is Twents voor 'kijk uit'. Uitkijken is wat we tegenwoordig met z'n allen toch echt wel moeten doen. Informatiebeveiliging en Privacy wordt namelijk steeds belangrijker. De risico's nemen toe en de wet- en regelgeving is veranderd. Het is noodzakelijk dat jij en je collega's ook mee veranderen. Kiek uut! kan je hierbij ondersteunen.",https://www.kiek-uut.nl,2017.0,Self-Employed,,Almelo,Overijssel,"Almelo, Overijssel"
https://www.linkedin.com/company/kingpin/,Kingpin,0-1 employees,Information Technology & Services,"We can help you maintain and improve your MFG/Pro installation, to get the most out of your business.
Furthermore, we have a new product ""Invoice Online"", providing easy and accurate invoicing as well as advanced tax recording & reporting. This is especially useful for self employed consultants and contractors.",http://www.kingpin.nl,,Privately Held,ERP specialist and straightforward solutions,Enschede,Overijssel,"Enschede, Overijssel"
https://www.linkedin.com/company/kite-interactive/,KITE,0-1 employees,Computer Software,Glide towards your online success!,https://www.kite-interactive.nl/,2020.0,Self-Employed,"React, React Native, Apps, Design Systems, Component Driven Development",Zwolle,Overijssel,"Zwolle, Overijssel"
https://www.linkedin.com/company/knoworries/,Knoworries,11-50 employees,Information Technology & Services,Power to the user,http://www.knoworries.nl,1995.0,Privately Held,"Network & Sytems Management, Helpdesk & Support, ICT-projecten, Virtualisatie, Consultancy, Office365, Microsoft, Hardware",Nieuwegein,Utrecht,"Nieuwegein, Utrecht"
https://www.linkedin.com/company/kodeanl/,Kodea,2-10 employees,Information Technology & Services,We build experiences,https://www.kodea.nl,2018.0,Public Company,,Enschede,Overijssel,"Enschede, Overijssel"
https://www.linkedin.com/company/konnect-ouderportaal-nl-/,Konnect,11-50 employees,Internet,"Konnect levert het meest uitgebreide pakket waarbij administratie, planning en oudercommunicatie samenkomen. Via een gepersonaliseerd portaal en app maken organisaties de opvangkwaliteit inzichtelijk en kunnen zij de ouders een totaalpakket aan mogelijkheden aanbieden. Eenvoudig in gebruik en herkenbaar in eigen huisstijl. De tevredenheid van de ouders groeit aantoonbaar, tezamen met de bereidheid de organisatie aan te bevelen bij referentiegroepen.

Mutaties in de opvang worden door ouders digitaal aangevraagd en doorgegeven (selfservice tools). Automatische verwerking leidt tot efficiency en kostenbesparingen aan de organisatiekant. Konnect is geen vervanging van, maar een aanvulling op verschillende kindplanningspakketten.",http://www.konnect.nl,2010.0,Privately Held,"Kinderopvang, Software, Oudercommunicatie, scholen, gastouder, app, ouderportaal",Kampen,Overijssel,"Kampen, Overijssel"
https://www.linkedin.com/company/koopinjouwstad-nl/,KoopInJouwStad.nl,11-50 employees,Internet,"Het Coronavirus brengt een onzekere tijd met zich mee. Veel mensen zijn aan huis gebonden, restaurants zijn gesloten en het is rustig in de winkels. StoreKeeper en MSG zijn daarom het KoopIn-platform gestart. Elke gemeente of stad kan zo een eigen webshop beginnen waarop lokale ondernemers hun producten kunnen verkopen. Voor 12:00 besteld is vandaag nog bezorgd! ",http://koopinjouwstad.nl,2020.0,Partnership,,Goor,Overijssel,"Goor, Overijssel"
https://www.linkedin.com/company/kostenbewaking-nl/,Kostenbewaking.nl,2-10 employees,Computer Software,Kostenbewaking.nl voorkomt faalkosten. Het geeft een compleet overzicht van uw project.,https://kostenbewaking.nl,2020.0,Partnership,,Oldenzaal,Overijssel,"Oldenzaal, Overijssel"
https://www.linkedin.com/company/kraamzorg-service-enschede-e.o./,Kraamzorg Service Enschede e.o.,11-50 employees,Publishing,"Kraamzorg Service Enschede e.o. is a publishing company based out of Egbert Gorterstraat 3, ALMELO, Netherlands.",http://www.reware.nl,,,,,,
https://www.linkedin.com/company/kraus-&-naimer-b.v./,Kraus & Naimer B.V.,11-50 employees,Computer Software,"Kraus & Naimer B.V. is a computer software company based out of Wegtersweg 38-40, HENGELO OV, Netherlands.",http://www.krausnaimer.com,,,,,,
https://www.linkedin.com/company/kreativ-software/,Kreativ Software,2-10 employees,Computer Software,"This listing was automatically created by LinkedIn. This listing is not currently maintained by, endorsed by or affiliated with Kreativ Software. Learn more",http://kreativsoftware.com,2012.0,,,Hengelo,Overijssel,"Hengelo, Overijssel"
https://www.linkedin.com/company/kroep-beveiliging-communicatie/,Kroep beveiliging | communicatie,2-10 employees,Information Technology & Services,Camerabewaking - Cloud - VoIP - WiFi,https://www.kroep.nl,2006.0,Sole Proprietorship,"Camera bewaking, Alarmsystemen, Cloud oplossingen, VoIP / Mobiele telefonie, Internet",,,
https://www.linkedin.com/company/kroep-elektro-b-v-/,Kroep Elektro B.V.,11-50 employees,Information Technology & Services,"Kroep Elektro B.V. is een modern en full-service elektrotechnisch installatiebedrijf en sinds 1928 actief in nieuwbouw, renovaties, onderhoud en inspecties van elektrotechnische gebouwgebonden installaties. 
De werkzaamheden vinden vanuit Enschede plaats in de regio, in de zakelijke markt, (semi) overheid en in de luxe particuliere sector.
Professionaliteit, kwaliteit en klanttevredenheid zijn de items die bij ons hoog in het vaandel staan.

Kroep elektro is gevestigd aan de Chroomsteden 22, Enschede, Overijssel, Nederland.

Kroep Elektro B.V. is an Information Technology and Services company.",https://www.kroep-techniek.nl/,1928.0,Privately Held,"Elektrotechniek, Verlichting (Led Expert) voor zowel binen als buiten, Brandmeldsystemen, Inspecties, Noodverlichting, Laadpalen en laadsystemen, Connected Lighting expert, Duurzame energiebronnen, Installatieontwerp, Energiemanagement",Enschede,Overijssel,"Enschede, Overijssel"
https://www.linkedin.com/company/l.s.o.-advies-&-leidingsystemen-twebo-systems/,L.S.O. Advies & Leidingsystemen | Twebo Systems,2-10 employees,Computer Software,"This listing was automatically created by LinkedIn. This listing is not currently maintained by, endorsed by or affiliated with L.S.O. Advies & Leidingsystemen | Twebo Systems. Learn more",http://leidingsystemen-enschede.nl,2016.0,,,Enschede,Overijssel,"Enschede, Overijssel"
https://www.linkedin.com/company/consulteq-nl/,L2Vision,2-10 employees,Information Technology & Services,Technisch Consultants met de Qualiteit die u wenst.,http://www.ConsulteQ.nl,2010.0,Privately Held,"Cloud Computing, Office 365, Windows Azure, System Center Suite 2012, Orchestrator 2012, Operations Manager, Configuration Manager, Windows Azure Pack",Zwolle,Overijssel,"Zwolle, Overijssel"
https://www.linkedin.com/company/lab-01/,Lab 01,0-1 employees,Information Technology & Services,"Lab 01 specialises in the development of custom web applications. Lab 01 provides all services related to the development process from requirements analysis to implementation and hosting. Projects are based on proven open source technology like Ruby on Rails and PostgreSQL. This shortens development time, reduces costs and improves reliability.",http://www.lab01.nl,2014.0,Privately Held,"Ruby on Rails, Web Application Development, Project Management, Interaction Design",,,
https://www.linkedin.com/company/label305/,Label305,11-50 employees,Computer Software,Creating products together. We are software engineers who put the end user first.,https://305.nl/,2010.0,Privately Held,,,,
https://www.linkedin.com/company/labotech-nederland-b.v./,Labotech Nederland B.V.,2-10 employees,Computer Software,"This listing was automatically created by LinkedIn. This listing is not currently maintained by, endorsed by or affiliated with Labotech Nederland B.V.. Learn more",,,,,,,
https://www.linkedin.com/company/lansink-it/,Lansink IT,0-1 employees,Information Technology & Services,Secure Networking,https://lansink.it,2018.0,Sole Proprietorship,,Haaksbergen,Overijssel,"Haaksbergen, Overijssel"
https://www.linkedin.com/company/lanters-technology/,Lanters Technology,2-10 employees,Information Technology & Services,Integration of IoT data-driven solutions in your organisation,https://www.lanterstechnology.nl,2018.0,Public Company,,,,
https://www.linkedin.com/company/larchford-limited/,Larchford Limited,11-50 employees,Information Services,"This listing was automatically created by LinkedIn. This listing is not currently maintained by, endorsed by or affiliated with Larchford Limited. Learn more",http://www.larchford.com,,,,,,
https://www.linkedin.com/company/theleadbase/,LeadBase,11-50 employees,Marketing & Advertising,"Leads genereren wordt steeds meer gezien als een strategisch bedrijfsproces. 
Wie zijn uw toekomstige klanten en hoe benadert u die op succesvolle wijze?
Belangrijke vragen voor de groei van uw bedrijf, maar helaas niet eenvoudig te beantwoorden.
De professionals van LeadBase gaan graag op zoek naar de juiste aanpak op online, offline & tele-marketingniveau voor uw bedrijf. Van leadgeneratie tot mystery calling en van linkbuilding tot marketingacties: Wij zijn graag het verlengstuk van uw organisatie.",http://www.theleadbase.nl,2018.0,Sole Proprietorship,"Leadgeneration, Online, offline & telemarketing, Sales operations, Linkbuilding, SEO, Web Analytics, Strategic planning",Enschede,Overijssel,"Enschede, Overijssel"
https://www.linkedin.com/company/leakfree/,LeakFree,2-10 employees,Information Technology & Services,"LeakFree.nl is een startup gespecialiseerd in IT-security en consultancy. 

Aangezien IT-infrastructuur steeds belangrijker wordt voor vele processen in het dagelijks leven wordt ook de veiligheid van deze infrastructuur steeds belangrijker. Vanuit de markt is een grote vraag naar deskundigen op dit gebied, maar er is nog te weinig aanbod wanneer het gaat om security oplossingen voor middelkleine bedrijven. 

Hier brengt LeakFree.nl verandering in. Met een team van studenten en security professionals leveren wij tegen een zeer concurrerend tarief security audits waarin de potentiële zwakheden van uw systeem (bv. uw website of webshop) worden geanalyseerd en toegelicht. 

LeakFree.nl begrijpt dat niet iedereen technisch onderlegd is. Daarom worden de resultaten op een gebruiksvriendelijke manier gepresenteerd: een duidelijk overzicht voor de manager en specificaties voor de technici. 

Met onze audits draagt u bij aan de zekerheid voor een veilig systeem waarbij uw gegevens en die van uw relaties goed beschermd worden.",,,Self-Employed,,,,
https://www.linkedin.com/company/lean-bridge/,LeanBridge,2-10 employees,Computer Software,"LeanBridge is een flexibele toolset die elke vorm van transitie ondersteunt. Gebaseerd op een krachtige workflowmanagement engine, worden organisaties in staat gesteld om transities soepel te doorlopen middels de M3© methode.

Wij hebben het voor elkaar gekregen om specifieke kennis en ervaring te borgen in separate libraries die via de methodische aanpak M3© gestructureerd ontsloten worden ter ondersteuning van transitietrajecten.

Elke transitie heeft behoefte aan zijn eigen ervaring! LeanBridge bevat diverse libraries die veel verschillende transitietrajecten ondersteunen. Gebruikersorganisaties van LeanBridge kunnen ook eigen kennis en ervaring in een library vastleggen en hergebruiken met LeanBridge.

Kijk voor meer informatie op www.leanbridge.com en maak snel een afspraak om LeanBridge te zien werken.",http://www.leanbridge.com,2015.0,Privately Held,"Transitie Management, Migratie Management, M3, Transformatie Management",,,
https://www.linkedin.com/company/leferink-document-works-b.v./,Leferink Document Works B.V.,11-50 employees,Computer Software,"Leferink Document Works B.V. is a computer software company based out of HAAKSBERGEN, Netherlands.",,,,,,,
https://www.linkedin.com/company/lenex-it/,Lenex IT,2-10 employees,Information Technology & Services,Make IT Easier,https://www.lenex.nl,2014.0,Partnership,,Steenwijk,Overijssel,"Steenwijk, Overijssel"
https://www.linkedin.com/company/leo-de-leede-interim-service/,Leo de Leede | Interim Service,0-1 employees,Information Technology & Services,Zelfstandig Interim Professional: Agile Scrum Master - Product Owner - Kanban System Design,,2016.0,Self-Employed,"Agile, Scrum, Kanban, Change Management, Incident Management, Team Management, Telecom, Mobile, RF Design & Optimization, Zakelijk tekenen",Goor,Overijssel,"Goor, Overijssel"
https://www.linkedin.com/company/leppink-electronica-&-computers-b.v./,Leppink Electronica & Computers B.V.,2-10 employees,Computer Software,"This listing was automatically created by LinkedIn. This listing is not currently maintained by, endorsed by or affiliated with Leppink Electronica & Computers B.V.. Learn more",,,,,,,
https://www.linkedin.com/company/leqqr/,Leqqr,2-10 employees,Computer Software,Leqqr levert self order systemen voor horeca (gerelateerde) bedrijven. Meer omzet en meer rust in de zaak.,http://www.leqqr.nl,2014.0,Privately Held,"Bestel apps, Bestel zuilen, Bestel websites",Enschede,Overijssel,"Enschede, Overijssel"
https://www.linkedin.com/company/lesscher-installatietechniek/,Lesscher Installatietechniek,51-200 employees,Telecommunications,"Lesscher Installatietechniek is met recht een totaalinstallateur.
Wij bieden hoogwaardige diensten in vier disciplines: Elektrotechniek,
Sanitair-techniek, Telecom & Infrastructuren en Warmtetechniek. Van één
enkele badkamer tot een bedrijfscomplex met alles erop en eraan: met
Lesscher werkt 't beter.   ""Alles onder controle""",http://www.lesscher.com,1969.0,Privately Held,"Elektrotechniek, Sanitairtechniek, Warmtetechniek, Telecom en infra",Saasveld,Overijssel,"Saasveld, Overijssel"
https://www.linkedin.com/company/license-masters-b-v-/,License Masters B.V.,2-10 employees,Information Technology & Services,"License Masters buys and sells used software licenses. Buying used licenses can be a very efficient way of buying software. You buy exactly the version, edition and number of licenses that you need, instead of buying the latest, most expensive, version. Save up to 40% on your software licenses.

Also, when you have bought new licenses for an upgrade project for instance, your old licenses may still be worth money. So you could consider selling them to License Masters

Please make sure that the following rules are met. We will Always check these rules if you start using our services:

- Licenses must be bought within the EU
- Licenses must be perpetual
- Licenses must be fully paid
- The software is no longer used

Please contact us when you find this interesting.",http://www.licensemasters.nl,2014.0,Public Company,"Microsoft licensing, Oracle Licensing, Second hand licenses, Buying licenses, Selling licenses, Tweedehands licenties, Tweedehands software, Preowned software, Software Asset Management",,,
https://www.linkedin.com/company/2go-software/,Licentie2GO,11-50 employees,Computer Software,De Nr. 1 software specialist!,https://licentie2go.com/,2014.0,Privately Held,"licenties, office, beveiligingssoftware, virtualisatie, zakelijk gebruik",Almelo,Overijssel,"Almelo, Overijssel"
https://www.linkedin.com/company/lijnrecht-reclamemakers/,Lijnrecht Reclamemakers,11-50 employees,Marketing & Advertising,"Lijnrecht is de (hulp)motor in het aanjagen en realiseren van groei voor bedrijven. Waarbij we opereren op de raakvlakken van business development, marketing communicatie en sales.",http://lijnrecht.nl,2005.0,,,,,
https://www.linkedin.com/company/limid/,Limid,11-50 employees,Information Technology & Services,Limid laat slimme technologie voor u werken!,http://limid.nl,2001.0,Privately Held,"Audiovisuele oplossingen, Presentatie apparatuur, Presentatie oplossingen, interactief, collaboration, touchscreens, visualisatie, video vergaderen, visueel samenwerken, SMART technologies, draadloos presenteren, presentatie scherm, professioneel audio, digital s",Zwolle,Overijssel,"Zwolle, Overijssel"
https://www.linkedin.com/company/linga-webdesign/,Linga,2-10 employees,Information Technology & Services,"Linga specializes in creating interactive (mobile) websites, e-commerce (webshop) and web applications. We have our own Content Management System (Linga CMS) which excels in usability and effectiveness integrated with Linga DMS, our Direct Marketing System. Call or mail us for more information.",https://www.linga.nl,2004.0,Privately Held,"Website design, Website development, Email marketing, Social Media integration, Responsive websites, E-commerce, SEO, Adwords",Zwolle,OV,"Zwolle, OV"
